"gene","protein_class","molecular_action","key_substrates","subcellular","tissues","cell_types","pathways","ko_phenotype","ko_severity","neural_phenotype","cerebellar_evidence","cancer_types","cancer_role","neuro_disease","differentiation_role","one_line_summary"
"Dnajc1","other","chaperone co-factor; translation modulation","ribosomal/ER client proteins","ER membrane; cytoplasm","brain; liver; bone marrow","neurons; hepatocytes; leukemic cells","protein quality control; ER stress; translation regulation","unknown (KO not well characterized in vivo)","unknown","expressed in neurons; linked to prion disease chaperone network","none specific","GBM; HCC; neuroblastoma; AML; osteosarcoma","oncogenic in GBM/HCC (promotes proliferation/survival); oncogenic in MYCN-amplified neuroblastoma","prion disease (modulates PrPD accumulation via chaperone network)","promotes proliferative state in neural and hematopoietic progenitors","Hsp40 subfamily C chaperone that modulates protein synthesis and ER quality control; oncogenic in GBM and HCC; interacts with prion chaperone network"
"Dnm3","GTPase/regulator","GTP hydrolysis; membrane tubulation; endocytosis","GTP; membrane lipids","cytoplasm; cytoskeleton; synaptic vesicles","brain; testis; bone marrow","neurons; megakaryocytes","endocytosis; membrane remodeling; cytokinesis; vesicular trafficking","impaired megakaryocyte maturation; reduced proplatelet formation","moderate","expressed in hippocampus; altered in forebrain ischemia","none specific","colon cancer; glioblastoma; cholangiocarcinoma","tumor suppressor in colon cancer (upregulated by siPRDX2); target of oncomiRs (miR-221, miR-23a)","Parkinson's disease modifier (modifies LRRK2 G2019S AAO); FTLD CSF biomarker","role in megakaryocyte differentiation; expressed during neural progenitor expansion","Dynamin GTPase involved in endocytosis and membrane remodeling; required for megakaryocyte differentiation; modifier of Parkinson's disease onset"
"Dohh","enzyme","iron-dependent dioxygenase; hypusination","eIF5A (deoxyhypusine intermediate on Lys50)","cytoplasm","ubiquitous; liver; lung","all proliferating cells; hepatocytes; pulmonary artery cells","hypusine biosynthesis; eIF5A activation; translation elongation; cell proliferation","embryonic lethal (KO mouse); arrested proliferation; impaired translation","lethal","essential for neural progenitor proliferation (inferred from eIF5A dependency)","none specific","leukemia; melanoma","tumor dependency for proliferation via eIF5A hypusination","none specific","essential enzyme for proliferating progenitor cells; supports translation elongation","Deoxyhypusine hydroxylase catalyzing the second step of eIF5A hypusination; essential for cell proliferation; targeted by ciclopirox and antimalarial compounds"
"Dyrk3","kinase","dual-specificity Ser/Thr and Tyr kinase; membraneless organelle dissolution","SRRM1; PCM1; ZNF207; stress granule components; nuclear speckle components","cytoplasm; nucleus; centrosome","testis; erythroid progenitors; brain","erythroid progenitors; proliferating cells","stress granule disassembly; mitotic progression; mTORC1 signaling; G2/M transition","impaired stress recovery; attenuated anemia-induced erythropoiesis; normal baseline hematopoiesis","mild (conditional)","expressed in brain; inhibition alters GBM metabolism","none specific","melanoma; neuroblastoma; GBM; OSCC","context-dependent oncogenic; promotes survival in melanoma and neuroblastoma; metabolic reprogrammer in GBM","none specific","promotes G2/M transition in proliferating cells; dissolves membraneless organelles at mitosis onset","Dual-specificity kinase that dissolves membraneless organelles at mitosis onset to release mitotic regulators; regulates stress granule disassembly and erythropoiesis during anemia"
"Efhc1","structural protein","microtubule-associated protein; cilia MIP; cell division regulator","microtubules; CACNA1E; mitotic spindle","centrosome; mitotic spindle; cilia axoneme; cytoplasm","brain; ependyma; trachea; sperm","neurons; ependymal cells; ciliated cells; neural progenitors","mitotic spindle organization; cilia motility; neuronal migration; apoptosis induction","disrupted mitotic spindle; impaired M-phase progression; increased apoptosis; cortical and subcortical malformation; impaired neuronal migration","moderate-severe","cortical and subcortical architectural defects; impaired neuronal/radial migration; ependymal cilia dysfunction","expressed in cerebellum and ependyma; low but detectable mRNA in multiple brain structures","gastric cancer (indirectly via lncRNA NRAV)","indirect/minor","juvenile myoclonic epilepsy (JME)","required for mitotic spindle integrity during neural progenitor divisions; regulates neuronal migration","Microtubule-associated and cilia inner protein mutated in juvenile myoclonic epilepsy; regulates mitotic spindle organization and neuronal migration during brain development"
"Efnb1","other","ephrin ligand; bidirectional cell-cell signaling","EPHB1; EPHB2; EPHB3 receptors","plasma membrane","brain; thymus; epithelium; vascular","neurons; T cells; epithelial cells; cortical progenitors","Eph-ephrin bidirectional signaling; axon guidance; cell migration; apoptosis (senescence)","craniofrontonasal syndrome phenotype in females (X-linked); disrupted apical surface size in cortical progenitors","moderate","cortical progenitor apical surface defects; axon guidance errors; commissural axon collapse","none specific","GBM; glioma; gastric cancer; esophageal cancer","context-dependent (tumor suppressor in glioma; promotes invasion in esophageal cancer via EPHB2)","craniofrontonasal syndrome","mediates contact-dependent repulsion during neural progenitor organization; regulates apical progenitor surface size","GPI-anchored ephrin B1 ligand mediating bidirectional Eph-ephrin contact repulsion; guides axons and cortical progenitor organization; mutated in craniofrontonasal syndrome"
"Egln3","enzyme","prolyl hydroxylase; oxygen sensor","HIF1A; HIF2A; PKM; ATF4; GPX4; TELO2","cytoplasm; ER","ubiquitous; brain; kidney; lung; thyroid","endothelial cells; neurons; microglia; renal cells; neuroendocrine cells","HIF-alpha destabilization; oxygen sensing; DNA damage response; angiogenesis regulation","impaired HIF regulation; context-dependent effects on tumor suppression","mild (adult conditional)","expressed in microglia; Egln3 differentially expressed in AD microglia","none specific","lung adenocarcinoma; renal cell carcinoma; gastric cancer; medullary thyroid carcinoma; endometrial cancer","tumor suppressor (frequently silenced/downregulated in multiple cancers); promotes HIF degradation","Alzheimer's disease (microglial Egln3 dysregulation)","suppresses proliferation via HIF destabilization; expressed during progenitor expansion","Prolyl hydroxylase oxygen sensor that hydroxylates HIF1A/2A to trigger proteasomal degradation under normoxia; frequently silenced as tumor suppressor; regulates DDR in lung adenocarcinoma"
"Ehmt1","enzyme","histone H3K9 methyltransferase (mono/di/trimethyl); H3K27 weak methylation","H3K9; H3K27; H1.4K26","nucleus; heterochromatin","brain; muscle; adipose; ubiquitous","neurons; myoblasts; OPCs; cancer cells","H3K9me2/3 heterochromatin formation; gene silencing; DNA methylation; G0/G1 cell cycle regulation; brown adipogenesis","Kleefstra syndrome (haploinsufficiency); intellectual disability; cardiac defects; autism","severe (haploinsufficiency lethal effects in humans)","intellectual disability; autism; Kleefstra syndrome; OPC proliferation regulation","expressed in cerebellum (inferred from broad brain expression)","rhabdomyosarcoma; ovarian cancer; prostate cancer","oncogenic in ARMS and ERMS rhabdomyosarcoma (maintains stemness); oncogenic in prostate cancer; target for PARPi-resistant ovarian cancer","Kleefstra syndrome; intellectual disability; autism spectrum disorder","silences differentiation genes during proliferative phase; promotes G0/G1 via E2F/MYC gene repression","H3K9me1/2/3 methyltransferase (GLP) that deposits repressive marks in euchromatin; haploinsufficiency causes Kleefstra syndrome; maintains cancer stem cell state in rhabdomyosarcoma"
"Ehmt2","enzyme","histone H3K9 methyltransferase (mono/dimethyl); H3K56me1; H1.4K26 methylation; non-histone methylation","H3K9; H3K56; H1.4K26; p53; DNMT3A; PCNA","nucleus; nuclear lamina","ubiquitous; brain; immune","OPCs; cancer cells; immune cells; embryonic cells","H3K9me2 heterochromatin; LAD organization; replication fork stability; immune gene regulation; pluripotency control","embryonic lethal (homozygous); severe defects in DNA methylation and gene silencing","lethal","expressed in OPCs; promotes OPC proliferation via H3K9me2","none specific","uveal melanoma; prostate cancer; various","oncogenic (promotes proliferation/migration in uveal melanoma and prostate cancer)","none specific","silences differentiation genes; promotes DNA replication fidelity (H3K56me1-PCNA); essential during embryonic proliferation","H3K9me1/2 methyltransferase (G9a) that organizes nuclear lamina-associated heterochromatin; promotes replication fork stability; oncogenic in uveal melanoma and prostate cancer"
"Eif2c2","other","RNA-induced silencing complex (RISC) catalytic core; miRNA-mediated mRNA silencing","target mRNAs (via miRNA guide); AGO2-miRNA complex","cytoplasm; nucleus (cardiac); P-bodies","ubiquitous","all cell types; cardiomyocytes","miRNA biogenesis and function; RISC assembly; post-transcriptional gene regulation; cell senescence reversal","pleiotropic; miRNA pathway disruption; early embryonic defects","lethal","broadly expressed; nuclear AGO2 in cardiomyocytes regulates gene expression","none specific","lung cancer; gastric cancer; gallbladder cancer; multiple cancers","oncomiR platform (target of oncogenic miRNAs); tumor suppressor miRNA silencing via AGO2","heart failure (nuclear AGO2 dysregulation)","post-transcriptional silencing of differentiation genes during proliferative state; miRNA-dependent gene regulation","AGO2 (EIF2C2) is the catalytic RISC Argonaute that executes miRNA-mediated silencing; nuclear AGO2 regulates gene expression in cardiomyocytes; central hub for miRNA-dependent proliferation control"
"Eif4g3","scaffold/adaptor","eIF4F complex scaffold; mRNA cap recognition assembly; translation initiation","eIF4E; eIF4A; PABP; mRNA 5' cap","cytoplasm; ribosome","testis; lymph nodes; ubiquitous","spermatocytes; lymph node stromal cells; proliferating cells","eIF4F cap-dependent translation initiation; meiotic progression; cell-cycle-regulated translation","male infertility (spermatocyte-specific defects); meiotic defects when partner proteins disrupted","mild (tissue-specific)","expressed in brain (inferred); regulated by DEAF1 in lymph node stromal cells","none specific","gastric cancer (via circ-EIF4G3)","circ-EIF4G3 acts as oncomiR sponge in gastric cancer","none specific","supports cap-dependent translation during active cell cycle; G1-phase translation burst","eIF4GII scaffold of the eIF4F translation initiation complex; functional homolog of EIF4G1; regulated by DEAF1 in immune stroma; linked to gastric cancer via circular RNA"
"Elk3","transcription factor","ETS transcriptional repressor/activator; ternary complex factor; RAS-ERK effector","SRF; serum response element; ETS motifs; target gene promoters","nucleus","ubiquitous; brain","endothelial cells; T cells; cancer cells; neurons","RAS-MEK-ERK signaling; serum response; angiogenesis; EMT; cell cycle control","impaired angiogenesis (endothelial-specific KO); reduced VEGF-driven vascular responses","moderate","expressed in glioma; promotes glioma angiogenesis and progression","none specific","glioma; GBM; prostate cancer; TNBC; ovarian cancer; OSCC","oncogenic (promotes proliferation, angiogenesis, chemoresistance, EMT in multiple cancers)","none specific","promotes cell cycle progression downstream of ERK in proliferating progenitors","ETS family ternary complex factor that activates or represses transcription downstream of RAS-ERK; promotes angiogenesis and EMT; oncogenic in glioma, prostate, and TNBC"
"Entpd4","enzyme","NTPDase; nucleoside triphosphate and diphosphate hydrolysis","UTP; TTP; CTP; GTP; GDP; UDP; CDP (not ADP/ATP for isoform 1)","Golgi; lysosomes; intracellular membranes","ubiquitous","all cell types; neurons","nucleotide recycling in protein glycosylation; purinergic signaling regulation; lysosomal nucleotide metabolism","unknown (KO not well characterized in vivo)","unknown","expressed in brain; methamphetamine/PCP-reactive in rat brain","chromosome 8p21.3 locus relevant to brain","gastric cancer (via circATXN7/miR-4319/ENTPD4 axis)","regulated tumor suppressor target of oncomiR networks","none specific","nucleotide homeostasis supporting proliferative metabolism; glycosylation fidelity","Intracellular NTPDase4 hydrolyzing nucleotide di/triphosphates in Golgi and lysosomes to recycle nucleotides for glycosylation; regulated by oncomiR networks in gastric cancer"
"Epcam","adhesion molecule","homophilic cell adhesion; regulated intramembrane proteolysis; signaling scaffold","claudin-7; FHL2; EpICD nuclear complex; FABP5; MYC; cyclin A/E","plasma membrane; nucleus (EpICD fragment)","epithelium; intestine; liver progenitors; embryonic stem cells","epithelial cells; stem/progenitor cells; tumor-initiating cells","Wnt signaling; MYC/cyclin upregulation; stem cell self-renewal; epithelial identity","intestinal barrier defect (congenital tufting enteropathy); impaired stem cell proliferation","severe (intestinal)","not expressed in normal neurons; marker of neuroepithelial progenitors","none specific","colorectal cancer; breast; lung; liver; prostate; gastric; pan-carcinoma marker","oncogenic (promotes proliferation, stem cell maintenance, metastasis); marks CSCs","congenital tufting enteropathy","promotes stem/progenitor cell proliferation and self-renewal; upregulates MYC and cyclins","Epithelial cell adhesion and signaling molecule that undergoes regulated intramembrane proteolysis to release EpICD nuclear fragment activating MYC and cyclin A/E; marks carcinoma cells and cancer stem cells"
"Erap1","protease","ER aminopeptidase; MHC-I peptide trimmer; antigen processing","HLA class I-binding peptide precursors (9-16 mers); angiotensin II; bradykinin precursors","ER lumen","ubiquitous; immune; kidney","antigen-presenting cells; keratinocytes; endothelial cells","MHC class I antigen presentation; peptide trimming; immune surveillance; blood pressure regulation","altered MHC-I peptidome; increased susceptibility to immunotherapy","moderate","expressed broadly; ERAP1 inhibition sensitizes neuroblastoma to immunotherapy","medulloblastoma (HH-MB): ERAP1 is a HH pathway regulator","neuroblastoma; lung cancer; prostate cancer; medulloblastoma","context-dependent (loss sensitizes to ICB; active promotes immune evasion in some tumors); HH pathway regulator in medulloblastoma","psoriasis; Behcet's disease; ankylosing spondylitis; autoimmune diseases","trims peptides in proliferating cells for MHC-I loading; modulates HH pathway activity","ER aminopeptidase that trims peptide precursors for MHC class I loading; loss sensitizes tumors to immune checkpoint blockade; regulates Hedgehog signaling in medulloblastoma"
"Erf","transcription factor","ETS transcriptional repressor; RAS-MEK-ERK effector; ERK nuclear export regulator","ETS/SRF binding sites; Ets2 promoter H1 element; RAS-ERK target genes","nucleus (ERK-regulated export)","ubiquitous; placenta; cranial sutures","trophoblast stem cells; fibroblasts; cranial suture cells","RAS-MEK-ERK downstream repression; cell proliferation/differentiation balance; trophoblast differentiation; craniosynostosis","craniosynostosis (haploinsufficiency); extraembryonic ectoderm defects; chorioallantoic attachment failure; Noonan-like syndrome","moderate-severe","ERK-regulated nuclear repressor; broadly expressed in brain","none specific","none specific (broadly relevant ETS repressor)","indirect cancer relevance as RAS-ERK output repressor","Noonan-like syndrome with craniosynostosis (ERF haploinsufficiency/truncation)","represses RAS target genes to restrain proliferation; nuclear export by ERK relieves repression","ETS transcriptional repressor downstream of RAS-MEK-ERK that restrains proliferation; haploinsufficiency causes craniosynostosis and Noonan-like syndrome; nuclear localization inversely proportional to ERK activity"
"Ermp1","protease","ER transmembrane metallopeptidase; UPR component; oxidative stress responder","unknown ER luminal substrates; involved in follicle organization","ER membrane","ovary; kidney; breast; colon; liver","oocytes; somatic follicle cells; epithelial cancer cells; renal cells","ER stress/UPR response; oxidative stress response; ovarian folliculogenesis; mTOR/AKT signaling","impaired ovarian follicle organization (KO mice); reduced oocyte integrity","moderate (reproductive)","none reported","none reported","breast cancer; colorectal cancer; endometrial cancer; liver cancer; renal cancer","oncogenic (promotes proliferation and progression in multiple cancers; broadly expressed in carcinomas)","none specific","active in proliferating progenitors under ER stress; supports cell survival during rapid growth","ER transmembrane metallopeptidase required for ovarian follicle organization; broadly upregulated in carcinomas; promotes cancer cell proliferation via AKT/mTOR and oxidative stress response"
"Esrp2","other","RNA splicing factor; epithelial isoform regulator","FGFR2 pre-mRNA; CD44; CTNND1; ENAH; liver-specific mRNAs","nucleus","liver; epithelium; prostate; kidney","hepatocytes; epithelial cells; liver progenitors","alternative splicing of FGFR2-IIIb vs IIIc; EMT splicing program; liver maturation; hepatocyte polyploidy","fetal-like splicing pattern retention; impaired liver maturation and polyploidization; orofacial clefting","moderate","none reported","none reported","HCC; breast cancer; prostate cancer; ccRCC","tumor suppressor (silenced in HCC and cancer; loss leads to fetal splicing reversion and tumor progression)","orofacial cleft (ESRP1/2 disruption)","drives epithelial splicing program switch during postnatal differentiation; suppresses fetal/proliferative isoforms","RNA-binding protein that enforces epithelial alternative splicing (notably FGFR2-IIIb); silenced in HCC/cancer to reactivate fetal splicing programs; regulates liver polyploidization and maturation"
"Etl4","other","large scaffold protein (KIAA1217); potential fusion partner in chromosomal rearrangements","unknown","cytoplasm; nucleus (inferred)","brain; liver; lung; broad","neurons; hepatocytes; cancer cells","RET signaling (as fusion partner); miR-603 host gene; unknown scaffold functions","unknown (KO not characterized)","unknown","highly expressed in brain; hosts miR-603 (AD-associated intronic miRNA); involved in neuronal processes","none specific","lung adenocarcinoma (KIAA1217-RET fusion); HCC (metastasis); OSCC; renal cancer","oncogenic as RET fusion partner in NSCLC; promotes HCC metastasis; overexpressed in OSCC","Alzheimer's disease (via intronic miR-603 which modulates AD risk)","broadly expressed during neural development; unknown proliferative role","Large scaffold protein (KIAA1217/ETL4) that acts as RET fusion partner in lung adenocarcinoma; hosts AD-associated intronic miR-603; promotes HCC metastasis; familial temporal lobe epilepsy locus (ETL)"
"Fam108b","enzyme","serine hydrolase/depalmitoylase (ABHD17B); acyl-protein thioesterase","palmitoylated proteins (including NRAS, ASCT2)","plasma membrane; cytoplasm","brain; ubiquitous","neurons; cancer cells; hepatic stellate cells","protein depalmitoylation; RAS membrane cycling; glutamine metabolism; lipid modification","impaired NRAS membrane association; altered RAS signaling","mild (inferred)","expressed in brain; involved in neuronal palmitoylation cycling","none specific","AML; ALS (biomarker); HCC (liver fibrosis context)","regulates NRAS membrane localization and oncogenic signaling via depalmitoylation","ALS (blood biomarker candidate)","modulates palmitoylation cycling of proliferative RAS signaling","Serine hydrolase/depalmitoylase (ABHD17B family) that removes palmitate from NRAS and other substrates to regulate membrane association and RAS oncogenic signaling"
"Fam129a","other","scaffold/stress-response protein; anti-apoptotic adaptor; AKT/mTOR pathway activator","AKT; mTOR; MMP2; Cyclin D1 (downstream targets)","cytoplasm","kidney; thyroid; brain; lung; liver","renal cells; thyroid cells; glioma cells; lung cancer cells","AKT/mTOR signaling; autophagy regulation; anti-apoptosis; cell migration; ER stress response","not well characterized in vivo (KO not reported)","unknown","highly expressed in GSCs (glioma stem cells); promotes GSC invasion","none specific","glioblastoma; NSCLC; thyroid cancer; esophageal cancer; colorectal cancer; bladder cancer","oncogenic (promotes invasion, proliferation, survival in multiple cancers; upregulates Cyclin D1/MMP2 via AKT/mTOR)","none specific","promotes anti-apoptotic and pro-proliferative signaling in progenitor/stem cells","Stress-response scaffold protein (NIBAN/FAM129A) that activates AKT/mTOR to upregulate Cyclin D1 and MMP2; promotes glioma stem cell invasion and survival; regulated by nutrient deprivation and autophagy"
"Fam129b","scaffold/adaptor","Inhibits RasGAP activity by binding Ras after EGFR-mediated Y593 phosphorylation; activates NRF2; suppresses TNFα-induced apoptosis","Ras, NRF2, EGFR","cytoplasm, plasma membrane","ubiquitous; high in melanoma, lung, liver","epithelial cells, cancer cells","MAPK/ERK, NRF2/antioxidant, Ras-MAPK, Wnt/β-catenin","Fam129b-null mice viable; mild immune phenotype; no severe developmental defects","low","none reported","none reported","melanoma, lung, breast, liver, TNBC","oncogenic; promotes invasion, metastasis, NRF2-dependent survival; overexpressed in multiple cancers","none","limited; expressed in proliferating cells; downregulated during differentiation","MINERVA/FAM129B scaffold inhibits RasGAP and activates NRF2 to promote cancer invasion and MAPK-driven proliferation"
"Fam3c","secreted factor","Cytokine-like secreted ligand; activates LIFR; induces EMT via STAT3 and TGFβ pathway; promotes invasion and metastasis","LIFR, STAT3, TGFβ pathway effectors","extracellular, secreted","widely expressed; inner ear, retina, intestine","epithelial cells, neurons, cancer cells","JAK-STAT, TGFβ/EMT, LIFR signaling","retinal lamination defects; inner ear expression essential; loss linked to hearing loss (DFNB17)","moderate","hearing loss (DFNB17 locus); retinal defects","expressed in inner ear neurons and retina; role in laminar formation","gastric cancer, breast cancer, lung cancer, glioma","oncogenic; promotes EMT, invasion, metastasis; upregulated in multiple cancers","hereditary hearing loss (DFNB17)","promotes EMT, suppresses epithelial differentiation","Secreted cytokine-like ILEI/FAM3C induces EMT and promotes metastasis across cancers via LIFR-STAT3 signaling"
"Fam40a","scaffold/adaptor","Core STRIPAK complex scaffolding subunit (STRIP1); anchors PP2A-STRN complex; regulates Hippo, cytoskeleton, and ER function","PP2A-A/C subunits, STRIATINs, MOBS, Hippo effectors (MST1/2)","cytoplasm, ER membrane","ubiquitous; high in brain, cochlea, retina","neurons, epithelial cells, muscle cells","STRIPAK/PP2A, Hippo/YAP, actin cytoskeleton","Strip1-null: embryonic lethal; retinal IPL disorganization; cochlear defects; hearing loss","high","retinal synaptic layer (IPL) defects; cochlear outer hair cell degeneration","expressed in retinal ganglion, amacrine, bipolar cells; IPL formation","breast cancer","tumor suppressive; loss promotes migration; loss induces p21 and cell cycle arrest","hearing loss; retinal degeneration","essential for early neuronal circuit formation in retina and cochlea","STRIP1/FAM40A scaffolds the STRIPAK-PP2A complex to regulate Hippo signaling, retinal circuit formation, and cochlear development"
"Fam43a","other","Unknown; no characterized enzymatic or signaling function; poorly characterized protein","unknown","unknown","limited expression data; reported in tumor microenvironment datasets","endothelial cells (cancer datasets)","unknown","unknown","unknown","none reported","none reported","bladder cancer, lung squamous, breast cancer (prognostic gene)","possible stromal/endothelial role in TME; low-confidence cancer relevance","none","unknown","Poorly characterized protein of unknown function with low expression fold-change; no defined molecular role or neural phenotype"
"Fbxo46","ubiquitin ligase","Substrate recognition subunit of SCF-FBXO46 E3 ligase complex; ubiquitinates FBXO31 (mTOR-phosphorylated) under basal conditions; stabilizes MDM2 by inhibiting MDM2 self-ubiquitination","FBXO31, MDM2","nucleus, cytoplasm","ubiquitous; brain expression reported","proliferating cells, neuronal progenitors","UPS/proteasome, p53-MDM2, cell cycle (G1/S checkpoint)","unknown in vivo","unknown","none reported","none reported","TNBC, colorectal, endometrial","oncogenic via MDM2 stabilization and p53 suppression; maintains low FBXO31 for normal cell cycle progression","none","maintains proliferative state by suppressing FBXO31 and p53 pathway; may be downregulated during differentiation","SCF-FBXO46 ubiquitin ligase maintains basal FBXO31 degradation and stabilizes MDM2 to sustain proliferation and suppress p53"
