"gene","protein_class","molecular_action","key_substrates","subcellular","tissues","cell_types","pathways","ko_phenotype","ko_severity","neural_phenotype","cerebellar_evidence","cancer_types","cancer_role","neuro_disease","differentiation_role","one_line_summary"
"Mgst1","enzyme","microsomal glutathione S-transferase; conjugates reduced glutathione to electrophilic substrates; glutathione peroxidase activity protecting against lipid peroxidation/ferroptosis","glutathione (GSH); hydrophobic electrophiles; lipid peroxides","endoplasmic reticulum membrane; microsomal fraction","liver; kidney; widespread","hepatocytes; granulosa cells; trophoblasts; tumor cells","glutathione metabolism; eicosanoid metabolism; ferroptosis resistance; redox homeostasis","embryonic lethal (knockout); impaired hematopoiesis in zebrafish knockdown","lethal","impaired hematopoiesis affects neural progenitor support indirectly","NA","gastric cancer; melanoma; colorectal cancer; laryngeal carcinoma","promotes tumor survival by blocking ferroptosis via lipid peroxide detoxification; overexpressed in multiple cancers; promotes proliferation","NA","NA","Microsomal GST1 of the MAPEG family that protects proliferating cells from ferroptosis by detoxifying lipid peroxides; embryonic lethal KO with hematopoietic defects"
"Mid1","ubiquitin ligase","E3 ubiquitin ligase; monoubiquitinates IGBP1 to deprotect PP2A catalytic subunit leading to PP2A degradation; regulates cytokinetic ring placement (fission yeast Mid1 ortholog is anillin-like)","IGBP1 (monoubiquitination); PP2A catalytic subunit (via IGBP1)","cytoplasm; microtubule cytoskeleton; midline structures","widespread; brain; lung; synovium","fibroblasts; smooth muscle cells; neural cells; macrophages","PP2A ubiquitin-proteasome pathway; mTOR/PP2A signaling; cytokinesis (via Mid1-PP2A complex); NF-kB/inflammation","viable; Opitz G/BBB syndrome phenotype (males); midline defects in humans","moderate (in humans: X-linked midline defects)","midline brain defects in Opitz syndrome; hyperactivated mTOR/PP2A signaling in neural tissue","NA","lung adenocarcinoma; asthma-associated inflammation","MID1-PP2A complex implicated in lung adenocarcinoma proliferation; promotes cell growth by suppressing PP2A tumor suppression","Opitz G/BBB syndrome (X-linked midline defects including brain)","NA","RING-domain E3 ubiquitin ligase that suppresses PP2A by ubiquitinating IGBP1; loss causes midline developmental defects in Opitz syndrome; MID1-PP2A complex promotes tumor cell growth"
"Mll3","enzyme","H3K4 monomethyltransferase (KMT2C); catalyzes H3K4me1 at enhancers; part of COMPASS-like complex with UTX; tumor suppressor epigenetic regulator","H3K4 (monomethylation); enhancer chromatin","nucleus; chromatin","widespread; hematopoietic tissue; epithelium","stem cells; progenitor cells; luminal epithelial cells; leukemia cells","H3K4me1 enhancer marking; enhancer-promoter interactions; Menin-MLL1 vs MLL3/4-UTX switch; DNA damage/fork stability (PTIP component)","tumor formation (KMT2C loss); impaired enhancer activity; susceptibility to esophageal/colorectal/prostate cancer; impaired BRCA1/2-deficient DNA repair via PTIP","severe (tumor suppressor; context-dependent lethality)","NA","NA","esophageal squamous cell carcinoma; colorectal cancer; prostate cancer; pancreatic cancer; AML","tumor suppressor; loss promotes transdifferentiation and cancer progression; loss sensitizes to PARP inhibitors in BRCA-deficient cancers","NA","regulates neural differentiation via H3K4me1 at enhancers during ESC-to-neural differentiation","H3K4me1 methyltransferase (KMT2C) that marks active enhancers and suppresses tumor progression; loss promotes transdifferentiation and cancer formation across multiple tissue types"
"Mllt1","scaffold/adaptor","component of Super Elongation Complex (SEC); promotes RNA Pol II pause release and transcriptional elongation; fusion partner of KMT2A in leukemia","RNA Pol II (indirect); MLL fusion partner","nucleus; transcription elongation complex","hematopoietic tissue; brain","hematopoietic progenitors; leukemia stem cells; neural progenitors","RNA Pol II transcriptional elongation (SEC); MLL-rearranged leukemia oncogenesis; Trithorax group activation","NA (human disease: KMT2A-MLLT1 leukemia when fused)","NA (fusion causes leukemia)","NA","NA","acute leukemia (ALL; AML); Wilms tumor","major oncogene when fused to KMT2A/MLL1 in pediatric acute leukemia; promotes leukemia stem cell self-renewal; EVI1-high KMT2A-MLLT1 AML is especially aggressive","NA","Trithorax group member; promotes transcription of developmental genes","SEC component (ENL) that drives RNA Pol II elongation; as KMT2A-MLLT1 fusion is a major pediatric leukemia oncogene promoting transcriptional elongation of proliferation and self-renewal genes"
"Mov10","enzyme","RNA helicase (5' to 3'); facilitates RISC-mediated miRNA silencing; promotes UPF1-mediated NMD; inhibits LINE-1 retrotransposition; antiviral RNA helicase","RNA secondary structures; LINE-1 RNA; miRNA targets; UPF1 substrates","cytoplasm; P-bodies; RISC complex","widespread; brain; testes; neurons","neurons; glia; immune cells; spermatocytes","miRNA-RISC silencing; nonsense-mediated decay (NMD); LINE-1 retrotransposition suppression; innate antiviral immunity (IKKepsilon/IRF3)","lethal in males (spermatogenesis failure in Mov10l1 paralog); Xenopus knockdown causes gastrulation and CNS defects","moderate-severe","gastrulation/notochord/neurulation failure in Xenopus; CNS development defects; required for CNS development","NA","NA","not a direct cancer driver; inhibits retrotransposition that could cause genomic instability","NA","regulates synaptic transmission; controls miRNA activity in neurons; expressed in neural tissue","RNA helicase that unwinds mRNA secondary structures for RISC loading, suppresses LINE-1 retrotransposition, and is required for CNS development in Xenopus; antiviral and neural functions"
"Mphosph9","other","negative regulator of ciliogenesis; recruits CP110-CEP97 complex to distal mother centriole to suppress cilia formation; undergoes TTBK2-mediated phosphorylation and proteasomal degradation to initiate ciliogenesis","CP110; CEP97","centrosome; distal end of mother centriole","widespread; brain","ciliated cells; neural progenitors","ciliogenesis regulation; centrosome cycle; Hedgehog signaling (via cilia)","NA","NA","NA","NA","gastric cancer; low-grade glioma (expression); multiple sclerosis GWAS locus; schizophrenia eQTL","upregulated in gastric cancer; potential oncogenic role via ciliogenesis suppression","multiple sclerosis (GWAS locus); schizophrenia (eQTL); Tourette syndrome (TWAS)","cilia-dependent differentiation signals (Shh) require Mphosph9 downregulation","Centrosomal regulator of ciliogenesis that suppresses cilia formation by anchoring CP110-CEP97; must be degraded by TTBK2 to allow cilia assembly and Hedgehog signaling"
"Mpp1","scaffold/adaptor","PDZ-domain scaffold/MAGUK family; regulates neutrophil polarity via AKT1 phosphorylation independent of PIK3CG; plus-end kinesin-related microtubule motor (MPP1/M phase phosphoprotein 1 function); membrane skeletal organizer","AKT1 (phosphorylation regulation); microtubules; membrane-associated PDZ partners","plasma membrane; cytoskeleton; nucleus (during mitosis)","hematopoietic tissue; brain; kidney","neutrophils; hematopoietic stem/progenitor cells; neurons","AKT/PI3K signaling; neutrophil polarity; membrane skeleton organization; mitosis","NA","none","NA","expressed in brain; MPP family members (MPP6) important for synaptic scaffolding in cerebellum","acute myeloid leukemia; urothelial carcinoma","MPP1 overexpression correlates with poor AML survival; promotes serial replating of hematopoietic progenitors; regulates immune escape in urothelial carcinoma via ABCC4","NA","membrane scaffolding role in hematopoietic progenitor expansion","MAGUK/PDZ scaffold protein that regulates neutrophil polarity via AKT1 and microtubule dynamics during mitosis; overexpression promotes hematopoietic progenitor expansion and AML"
"Mzf1","transcription factor","Krueppel-family C2H2 zinc finger transcription factor; activates glycolytic genes; promotes oncogenic transcription; regulates IGF-IR expression; recruits CHD7 to repress p16INK4A","CDKN2A/p16INK4A (repression); IGF1R promoter; glycolytic gene promoters","nucleus","hematopoietic tissue; brain; widespread","myeloid progenitors; glioblastoma cells; neuroblastoma cells; T-cell lymphoma","myeloid differentiation; glycolysis/Warburg effect; IGF-IR/NPM-ALK signaling; senescence bypass","lethal neoplasias (myeloid chloroma-like liver infiltration in Mzf1-/- mice)","severe (tumor suppressor in myeloid lineage; KO causes myeloid malignancy)","NA","NA","glioblastoma; neuroblastoma; hepatocellular carcinoma; lung cancer; non-small cell lung cancer","context-dependent: tumor suppressor in myeloid differentiation (KO causes leukemia); oncogene in solid tumors (GBM, neuroblastoma, HCC); promotes Warburg effect and immune evasion","NA","myeloid differentiation factor; loss leads to autonomous proliferation of myeloid progenitors","Krueppel-family zinc finger TF that drives myeloid differentiation (KO causes leukemia-like disease) yet acts as an oncogene in solid tumors by promoting glycolysis and repressing p16INK4A"
"Nampt","enzyme","nicotinamide phosphoribosyltransferase (NAMPT/PBEF/visfatin); rate-limiting enzyme of NAD+ salvage pathway; also secreted cytokine/adipokine without enzymatic activity","nicotinamide + PRPP → NMN (→ NAD+)","cytoplasm (intracellular); secreted (extracellular)","adipose; liver; immune cells; widespread","neutrophils; macrophages; NK cells; tumor cells; satellite cells","NAD+ biosynthesis salvage pathway; SIRT1/circadian clock; PD-L1 immune evasion; metabolic reprogramming","NA","NA","NA","NA","AML; breast cancer; gastric cancer; hepatocellular carcinoma; multiple cancer types","oncogenic; NAD+ production sustains tumor metabolism; NAMPT inhibition kills AML LSCs; promotes PD-L1-mediated immune evasion via TET1","NA","NAD+ required for satellite cell proliferation during muscle regeneration; regulates circadian oscillation of differentiation genes","Rate-limiting NAD+ biosynthesis enzyme (NAMPT) that fuels tumor metabolism and immune evasion; drives PD-L1 expression via NAD+-dependent TET1 and promotes cancer cell survival"
"Ncoa6","transcription factor","nuclear receptor coactivator (NCOA6/AIB3/RAC3); chromatin remodeling via HAT recruitment; coactivates steroid/retinoid/thyroid/PPAR nuclear receptors and NF-kB; Hippo/YAP/TAZ coactivator","nuclear receptors (ER, GR, RAR, RXR, TR, VDR, PPAR); NF-kB; Yorkie/YAP","nucleus; chromatin","widespread; placenta; heart; liver","hepatocytes; cardiomyocytes; macrophages; endometrial epithelium","nuclear receptor signaling; Hippo/YAP; NF-kB; H3K4me1 (MLL3/4 complex component via KMT2D interaction)","embryonic lethal; cardiac and placental defects; dilated cardiomyopathy (cardiac-specific loss)","lethal","NA","NA","pancreatic ductal adenocarcinoma; hepatocellular carcinoma; breast cancer; endometrial cancer","overexpressed in multiple cancers; promotes tumor growth; coactivates oncogenic nuclear receptors and YAP/TAZ; correlates with poor prognosis","NA","coactivates nuclear receptors that drive cell fate; involved in cardiac and embryonic differentiation","Multi-functional nuclear receptor coactivator (NCOA6/AIB3) that remodels chromatin and coactivates ER, PPAR, Hippo/YAP, and NF-kB; embryonic lethal KO; overexpressed in multiple cancers"
"Ncor1","transcription factor","nuclear receptor corepressor (NCoR1); recruits HDAC3 to mediate transcriptional repression; represses nuclear receptors (TR, RAR, PPAR), BCL6, and androgen receptor signaling; regulates circadian clock via NR1D1/BMAL1","HDAC3 (recruits); nuclear receptors (TR, RAR, PPARs); BCL6; ZBTB7A/androgen receptor; ARNTL/BMAL1; TSHB","nucleus; corepressor complex","liver; immune cells; intestinal epithelium; widespread","macrophages; dendritic cells; T cells; Treg cells; intestinal epithelial cells; thymocytes","HDAC3/histone deacetylation; circadian clock; lipid metabolism; immune tolerance; androgen receptor repression","impaired lipid metabolism; metabolic syndrome protection (intestinal KO); impaired Treg suppressive function; altered thymocyte survival","moderate","altered thymocyte survival; impaired T cell lineage development; no specific neural KO phenotype reported","SHH-MB expressed (Ncor1 corepressor may modulate Shh pathway)","colorectal cancer; medulloblastoma (SHH); lymphoma","intestinal Ncor1 deletion increases adenoma burden in ApcMin/+ mice; tumor suppressive in colon; SHH-MB transcriptomic data shows NCOR1 alterations","NA","represses nuclear receptor-mediated differentiation programs; regulates lipid metabolism in hepatocytes","Nuclear receptor corepressor that recruits HDAC3 to silence metabolic, immune, and hormonal gene programs; tumor suppressive in intestinal epithelium and implicated in SHH-MB transcriptomics"
"Nefh","structural protein","neurofilament heavy chain (NF-H); intermediate filament protein maintaining neuronal axonal caliber; forms heteropolymers with NEFL and NEFM; also partners with PRPH and INA","NEFL; NEFM; PRPH; INA (polymerization partners)","axon; cytoskeleton; neuronal cell body","brain; spinal cord; peripheral neurons","mature neurons; motor neurons; DRG neurons; myelinated axons","neurofilament cytoskeleton assembly; axonal caliber maintenance; axonal transport","NA (neurofilament subunit knockouts reduce axon caliber in mice)","mild (axon caliber reduction)","reduced axon caliber; impaired axonal transport; neurodegeneration susceptibility","expressed in mature cerebellar neurons; upregulated during granule neuron differentiation (P14/P56 group, high avg_fc 3.74)","prostate cancer; renal cell carcinoma (methylation marker); lung cancer","NEFH promoter methylation is a potential tumor/prognostic marker in RCC and other cancers; reduced expression in many cancers","ALS (NEFH phosphorylation and aggregation); neurodegenerative diseases (protein aggregation)","major marker of terminal neuronal differentiation; upregulated as neurons mature and extend axons","Neurofilament heavy chain subunit that maintains axonal caliber in mature neurons; NEFH is a late-differentiation marker highly induced in mature GNPs; NEFH methylation is a cancer biomarker and its aggregation is implicated in ALS"
"Ninj2","adhesion molecule","homophilic transmembrane adhesion molecule; promotes axonal growth and nerve regeneration; forms filaments but cannot rupture plasma membrane (unlike NINJ1); oligomerizes at cell surface","homophilic NINJ2 (adhesion); p53 (DNA damage response interaction)","plasma membrane","brain; peripheral nervous system; Schwann cells; vascular endothelium","neurons; Schwann cells; glia; glioma cells; endothelial cells","nerve regeneration; axonal growth; p53 tumor suppression pathway; myelination (Schwann cells); inflammation; metabolic homeostasis","short lifespan; spontaneous tumors; systemic inflammation; metabolic defects; insulin resistance; dysregulated lipogenesis","severe","spontaneous tumors with neural involvement; metabolic and inflammatory defects affecting CNS indirectly","myelination role in peripheral nervous system; expressed in glioma; promotes glioma proliferation","glioma; colorectal cancer; melanoma","pro-tumorigenic in glioma and CRC (shRNA knockdown inhibits survival/proliferation); induced by DNA damage in p53-dependent manner and can act as tumor suppressor; context-dependent","multiple sclerosis (GWAS; IFN-beta response modifier); stroke/coronary artery disease susceptibility","nerve regeneration molecule; promotes axonal growth; expressed during neural differentiation","Homophilic adhesion molecule on neurons and Schwann cells that promotes nerve regeneration and axon growth; KO mice develop tumors and metabolic disease; overexpressed in glioma and CRC where it promotes proliferation"
"Nle1","scaffold/adaptor","WD40-repeat scaffold; regulates Notch signaling activity; required for pre-ribosomal RNA processing (PeBoW complex component via Ytm1 ortholog); controls CDKN1A and Wnt pathway gene expression","pre-rRNA (32S processing); Notch pathway components; CDKN1A/p21","nucleus; nucleolus; pre-ribosomal particles","widespread; embryo (ICM); intestinal epithelium","inner cell mass cells; epiblast cells; intestinal epithelial cells; colorectal cancer stem cells","Notch signaling; ribosome biogenesis (PeBoW complex); Wnt signaling; CDKN1A regulation","embryonic lethal (inner cell mass failure); epiblast-specific KO causes rapid cell elimination","lethal (ICM and epiblast)","embryonic lethal; brain-specific role not directly studied but Notch-dependent neural development implications","NA","hepatocellular carcinoma; colorectal cancer; melanoma; glioblastoma","NLE1 overexpression supports tumor cell survival; promotes ribosome biogenesis in colorectal cancer stem cells upon SMAD4 loss; required for BTSC self-renewal in GBM","NA","required for embryonic survival; promotes ribosome biogenesis needed for cell growth; Notch-dependent cell fate","WD40/PeBoW ribosome biogenesis factor and Notch regulator required for embryonic inner cell mass survival; overexpressed in colorectal cancer stem cells and HCC to support proliferative ribosome demand"
"Nlrc5","other","NOD-like receptor family CARD domain containing 5; transcriptional regulator of MHC class I genes (CITA/NLRC5 transactivasome); probable negative regulator of NF-kB and type I/II interferon signaling; innate immune homeostasis regulator","MHC class I promoters (transactivation); NF-kB pathway components","nucleus; cytoplasm","immune cells; intestinal epithelium; widespread","macrophages; T cells; NK cells; intestinal epithelial cells; stem cells","MHC-I antigen presentation; NF-kB signaling; innate immune homeostasis; antiviral defense; intestinal NEC protection","intestinal NEC susceptibility (inducible intestinal KO); quiescent stem cells downregulate NLRC5 for immune evasion","moderate (intestinal)","NA","NA","multiple cancers (melanoma; AML; endometrial; small cell lung cancer; brain metastasis)","tumor suppressor via MHC-I upregulation and immune surveillance; loss promotes immune evasion; KDM6A binds and activates NLRC5 in multiple myeloma; LATS1/2 loss downregulates NLRC5/MHC-I","NA","quiescent intestinal stem cells downregulate NLRC5 for immune evasion; cycling stem cells express it and are killed by T cells","NLR family regulator that drives MHC class I antigen presentation; loss enables tumor immune evasion across multiple cancers; KDM6A/H3K27me2 axis controls its expression in multiple myeloma"
"Nme4","enzyme","mitochondrial nucleoside diphosphate kinase (NDPK-D/NM23-H4); transfers gamma-phosphate from ATP to NDPs; produces GTP for mitochondrial GTPases (OPA1); facilitates cardiolipin transfer from inner mitochondrial membrane to outer membrane; supports mtDNA maintenance","nucleoside diphosphates (GDP, UDP, CDP, ADP); cardiolipin (lipid transfer); OPA1 (GTP supply)","mitochondria; inner mitochondrial membrane; intermembrane space","widespread; placenta; testes","mitochondria-rich cells; trophoblasts; tumor cells","mitochondrial nucleotide homeostasis; cardiolipin trafficking; mitochondrial dynamics (OPA1/fusion); mitophagy; respiratory chain support","NA (mice - NME4 role in preeclampsia via placental defects described)","NA","NA","NA","lung adenocarcinoma; renal cell carcinoma; esophageal squamous cell carcinoma; MDS/AML; ovarian cancer","context-dependent; inhibits invasion in ESCC; reduced expression correlates with MDS progression; upregulated in ccRCC with poor prognosis","NA","cardiolipin homeostasis required for mitochondrial integrity during differentiation","Mitochondrial NDPK (NME4/nm23-H4) that maintains nucleotide homeostasis and cardiolipin distribution at the inner membrane; supports OPA1-mediated fusion and respiratory ATP production; context-dependent cancer roles"
"Nop16","other","nucleolar protein; H3K27 mimic (endogenous EED decoy); component of nucleolar protein complex; c-Myc and estrogen transcriptional target; promotes ribosome biogenesis","EED (PRC2 component, via H3K27 mimicry); rRNA processing complex components","nucleolus; nucleus","widespread; prostate; liver; breast","tumor cells; prostate cancer cells; hepatocytes; neural cells","ribosome biogenesis; Polycomb/PRC2 regulation (H3K27 mimic/decoy); c-Myc transcriptional program; mTOR","NA","NA","NA","identified in pediatric high-grade glioma network analysis","hepatocellular carcinoma; prostate cancer; breast cancer; nasopharyngeal carcinoma; glioma","oncogenic; promotes tumor cell proliferation; regulated by c-Myc; high expression correlates with poor prognosis; acts as PRC2 decoy to derepress proliferation genes","NA","regulated by c-Myc which drives proliferative gene programs","Nucleolar protein (HSPC111/NOP16) that acts as an endogenous H3K27 mimic to sequester EED/PRC2, derepressing proliferation genes; a direct c-Myc transcriptional target overexpressed in multiple cancers"
"Notch2","receptor","type I transmembrane receptor; ligand (JAG1/JAG2/DLL1)-activated; releases NICD that forms transcriptional activator complex with RBPJ; regulates cell-fate determination, proliferation, apoptosis, and differentiation","JAG1; JAG2; DLL1; RBPJ (transcriptional complex); NFATc1 (osteoclastogenesis); NF-kB/RELA","plasma membrane; nucleus (NICD)","brain; liver; lung; smooth muscle; bone marrow; lymph nodes; kidney","B cells; marginal zone B cells; smooth muscle cells; hepatocytes; myofibers; renal progenitors","Notch signaling; Wnt (cross-talk); NF-kB; osteoclastogenesis; follicular development; lymphocyte differentiation","embryonic and perinatal lethality (full KO); MZB cell loss; glomerulosclerosis; impaired muscle atrophy response","severe (lethal)","NA","NA","marginal zone lymphoma; mantle cell lymphoma; DLBCL; hepatocellular carcinoma; renal cancer","oncogenic in B-cell lymphomas (MZL, MCL) via NOTCH2 mutations; promotes liver cancer stem cell self-renewal; activates Myc-dependent gene programs in MZB cells","NA","promotes quiescence/differentiation in some contexts (smooth muscle, myofibers); specifies B-cell and renal cell fate","Notch family receptor activated by JAG/DLL ligands that specifies marginal zone B cell, renal, and vascular cell fates; mutated in B-cell lymphomas; promotes cancer stem cell self-renewal in HCC"
"Nr2c2ap","transcription factor","nuclear receptor corepressor; suppresses NR2C2/TR4-mediated transactivation by blocking TR4 binding to its response element","NR2C2/TR4 (suppression of DNA binding)","nucleus","widespread","NA","nuclear receptor signaling (TR4/NR2C2 pathway)","NA","none","NA","NA","NA","no established cancer role","NA","NA","Nuclear receptor corepressor that suppresses TR4/NR2C2 transcriptional activity by blocking its DNA binding; poorly characterized; no direct cancer or neural phenotype established"
"Nr4a1","transcription factor","orphan nuclear receptor; binds NGFI-B response element (NBRE); regulates inflammatory response in macrophages by repressing TCA cycle genes; inhibits NF-kB; activates apoptosis; sequesters STK11 to inhibit AMPK; cytosolic NBRE-containing mtDNA sensor","STK11/LKB1 (nuclear sequestration); NF-kB (IL2 promoter binding); TCA cycle genes; NR4A2 (dimerization on PDGF-RE); mitochondrial DNA (cytosolic sensor)","nucleus; cytoplasm; mitochondria-associated","widespread; liver; immune cells; vascular smooth muscle; brain","macrophages; T cells; Tregs; hepatocytes; osteoblasts; mesenchymal stem cells; neurons","NF-kB repression; AMPK/energy sensing; apoptosis; macrophage metabolic reprogramming; liver regeneration; vascular injury response; bone regeneration","vascular hyperproliferative response; impaired bone regeneration (when suppressed by TGF-b); impaired macrophage metabolic regulation","mild-moderate","NA","expressed in cerebral cortex; macrophage activation involves CNS macrophages (microglia)","multiple cancers (breast; colon; prostate; leukemia); tumor microenvironment","complex: pro-apoptotic tumor suppressor in some cancers; immunosuppressive in TME by maintaining Treg identity and T cell exhaustion; PROTAC degradation enhances anti-tumor immunity","NA","anti-differentiation role in some progenitors; regulates macrophage differentiation; promotes T cell exhaustion","Orphan nuclear receptor NR4A1 (Nur77) that represses NF-kB and TCA cycle genes in macrophages and activates apoptosis; maintains Treg/T cell exhaustion in tumor microenvironment; targeted by PROTAC degraders for cancer immunotherapy"
