"gene","protein_class","molecular_action","key_substrates","subcellular","tissues","cell_types","pathways","ko_phenotype","ko_severity","neural_phenotype","cerebellar_evidence","cancer_types","cancer_role","neuro_disease","differentiation_role","one_line_summary"
"Dock4","GTPase/regulator","GEF activating RAC1; regulates neurite outgrowth and adherens junctions; controls HSC differentiation; required for cell migration","RAC1","cytoplasm; cell membrane","brain; hematopoietic tissue; intestine","neurons; hematopoietic stem cells","RAC1 signaling; neuritogenesis; hematopoiesis; Wnt signaling","embryonic lethality (complete); decreased anxiety; abnormal startle reflex; abnormal behavior","lethal","embryonic lethal; anxiety reduction; startle abnormality",NA,"glioblastoma (functional - promotes differentiated cell state); myelodysplastic syndrome (HSC differentiation block)","reduced DOCK4 in -7/del7q MDS blocks HSC differentiation; context-dependent role in GBM differentiation states","autism spectrum disorder; schizophrenia (associated RAC1-GEF)","activates RAC1 to drive neurite outgrowth and neuronal differentiation; required for HSC differentiation","Atypical RAC1-GEF required for neurite outgrowth, neuronal differentiation, and HSC maturation; reduced in myelodysplastic syndrome with del7q; implicated in ASD and schizophrenia"
"Lrrk2","kinase","serine/threonine kinase phosphorylating RAB GTPases and other substrates; regulates vesicle trafficking, autophagy, ciliogenesis, and innate immunity","RAB3A/B/C/D; RAB8A/B; RAB10; RAB12; RAB29; RAB35; RAB43; LRRK1","cytoplasm; endolysosomal membranes; mitochondria-associated membranes","brain; kidney; immune cells; lung","dopaminergic neurons; macrophages; microglia; renal tubular cells","RAB GTPase cycle; mTOR/autophagy; SHH/cilia signaling; innate immune signaling","increased grooming; alopecia; abnormal hippocampal mossy fiber morphology; increased neuronal precursor cell number; abnormal dendrites; impaired dopamine response","moderate","increased grooming; abnormal hippocampal mossy fibers; increased neuronal precursors; abnormal dendrites",NA,NA,"not established as cancer driver","Parkinson disease (most common familial mutation G2019S; sporadic risk locus); inflammatory bowel disease; acute kidney injury","regulates dopaminergic neuron development; gain-of-function G2019S disrupts neuronal differentiation","Serine/threonine kinase phosphorylating RAB GTPases to regulate vesicle trafficking; G2019S gain-of-function mutation is most common cause of familial Parkinson disease"
"Nr0b2","transcription factor","transcriptional corepressor; inhibits nuclear receptor transactivation; represses NR5A2, HNF4A, NR1D1, BHLHE41/HNF1A; regulates circadian CYP expression","NR5A2; HNF4A; NR1D1; HNF1A; CYP2C38; CYP2A5; CYP1A2; NEUROD1","nucleus","liver; intestine; testis; gonad","hepatocytes; enterocytes; gonadal cells","bile acid/cholesterol homeostasis; lipid metabolism; circadian clock; nuclear receptor signaling; sex hormone regulation","decreased circulating cholesterol; abnormal bile salt homeostasis; increased bile salt; increased liver triglycerides; small testis; increased testosterone","moderate",NA,NA,NA,"not established as cancer driver","obesity and insulin resistance (mutations in SHP); liver disease","NA (primarily hepatic/metabolic)","represses hepatic lipid and cholesterol gene programs; corepressor during hepatocyte differentiation"
"Orphan nuclear receptor corepressor (SHP/NR0B2) that suppresses nuclear receptor activity to regulate bile acid, cholesterol, and circadian lipid metabolism; linked to obesity and liver disease","","","","","","","","","","","","","","","",""
"Sv2a","transporter","synaptic vesicle glycoprotein; maintains readily releasable vesicle pool; enhances low-frequency neurotransmission; receptor for botulinum toxins A/D/E",NA,"synaptic vesicle membrane","brain; pancreatic islets; neuroendocrine cells","neurons; beta cells; neuroendocrine cells","synaptic vesicle exocytosis; neurotransmitter release; insulin secretion","seizures; postnatal growth retardation; abnormal IPSCs; postnatal lethality (complete); decreased body size","lethal","seizures; abnormal IPSCs; postnatal lethal",NA,NA,"not a cancer driver; used as PET imaging target for synaptic density in neurological disease","epilepsy (target of levetiracetam/brivaracetam); Alzheimer disease (synaptic density marker); Parkinson disease; spinocerebellar ataxia (synaptic loss biomarker); spinal cord injury","maintains readily releasable vesicle pool essential for neuronal and neuroendocrine secretion","Synaptic vesicle glycoprotein maintaining readily releasable vesicle pool; target of anti-epileptic drugs levetiracetam/brivaracetam; essential for postnatal survival"
"Zdhhc2","enzyme","palmitoyl acyltransferase (DHHC domain); palmitoylates AKAP5, DLG4/PSD-95, RGS7BP; regulates synaptic AMPAR clustering and trafficking","AKAP5; DLG4/PSD-95; RGS7BP","endoplasmic reticulum; plasma membrane; dendritic recycling endosomes","brain; immune cells; heart","neurons; B cells; dendritic cells; T cells","palmitoylation; synaptic plasticity; AMPAR trafficking; Gi/o signaling","dilated heart left ventricle; abnormal immune phenotypes; increased fasting glucose; abnormal T cell activation; decreased pDC number","moderate","not described in neural-specific KO; synaptic function implicated via palmitoylation substrates",NA,"glioblastoma (expression-based)","expression altered in GBM (not functional); tumor suppressor candidate","schizophrenia (GWAS candidate; palmitoylates PSD-95 and AKAP79/150)","regulates AMPAR clustering and synaptic LTP via palmitoylation of PSD-95 and AKAP5","DHHC palmitoyl acyltransferase that palmitoylates PSD-95 and AKAP5 to regulate AMPAR trafficking and synaptic plasticity; GWAS candidate for schizophrenia"
"Lrp1","receptor","multi-ligand endocytic/signaling receptor; mediates endocytosis of lipoproteins, alpha-2-macroglobulin, plasminogen activator complexes, APP, TAU, BDNF receptor NTRK2, GDNF; activates intracellular signaling","TAU/MAPT; APP; NTRK2; GDNF; alpha-2-macroglobulin; chylomicron remnants","plasma membrane; endolysosomes","brain; liver; vasculature; intestine","neurons; macrophages; hepatocytes; smooth muscle cells; astrocytes","LDL/lipoprotein endocytosis; APP processing; tau spread; BDNF-NTRK2 trafficking; TGF-beta signaling","embryonic lethal (complete); internal hemorrhage; liver degeneration; hernia; diaphragmatic hernia; abnormal body wall","lethal","embryonic lethal (neuron-specific KO shows neurodegeneration)","neural stem cell marker and trafficking role; cerebellar context not directly demonstrated","gallbladder cancer; glioma (TME signaling)","promotes or modulates tumor microenvironment signaling in GBM/gallbladder cancer","Alzheimer disease (APP processing; tau endocytosis and spread); vascular dementia; neurodegeneration","controls NTRK2 trafficking and BDNF signaling; mediates tau uptake; required for normal neuron survival","Multi-ligand endocytic receptor mediating lipoprotein clearance, APP metabolism, and tau spread; loss causes neurodegeneration; central role in Alzheimer disease pathophysiology"
"Pacsin1","scaffold/adaptor","F-BAR membrane tubulation protein; recruits dynamin (DNM1/2/3) for synaptic vesicle endocytosis; regulates neurite formation and AMPAR endocytosis via PICK1; stabilizes microtubules via MAPT interaction","DNM1; DNM2; DNM3; COBL; WASL; MAPT; PICK1; AMPA receptors","plasma membrane; cytoplasm; dendritic endosomes","brain","neurons; plasmacytoid dendritic cells","synaptic vesicle endocytosis; actin cytoskeleton; neuritogenesis; AMPAR trafficking; LTD; interferon signaling","decreased interferon-alpha secretion; decreased body weight; reduced fertility; abnormal electrophysiology; decreased synaptic depression; abnormal IPSCs; tonic-clonic seizures; abnormal synaptic vesicle recycling","moderate","decreased synaptic depression; abnormal IPSCs; tonic-clonic seizures; abnormal synaptic vesicle recycling","PACSIN1 regulates cerebellar LTD via AMPAR endocytosis (PICK1 interaction)","glioma (expression screen)","expression altered in glioma (screen, not functional)",NA,"regulates AMPAR endocytosis during LTD; mediates neurite outgrowth","Neuron-specific F-BAR scaffold mediating synaptic vesicle endocytosis and AMPAR internalization during LTD; KO shows seizures and impaired synaptic vesicle recycling"
"Rims1","scaffold/adaptor","active zone scaffold; RAB3 effector; maintains neurotransmitter release probability; required for short-term synaptic plasticity; regulates LTP and LTD; organizes readily releasable pool","RAB3A; RAB3B; SNAP-25; VAMP2; RIM-binding proteins","presynaptic active zone","brain; retina","neurons; melanocytes","presynaptic active zone assembly; synaptic vesicle priming; cAMP-PKA signaling at synapse; autism risk pathways","abnormal CNS synaptic transmission; reduced LTP; abnormal LTD; abnormal excitatory and inhibitory PSPs; impaired synaptic plasticity; disorganized barrel cortex; abnormal maternal nurturing","moderate-severe","abnormal CNS transmission; reduced LTP; abnormal LTD; disorganized barrel cortex; impaired synaptic plasticity",NA,"glioblastoma (prognostic/expression); medulloblastoma (circRNA expression screen)","RIMS1 expression prognostic in GBM; MB circRNA screen (not functional)","autism spectrum disorder (functional convergence screen); migraine (GWAS eQTL)","regulates synaptic plasticity essential for circuit formation","Presynaptic active-zone scaffold essential for vesicle priming and synaptic plasticity; KO impairs LTP/LTD and barrel cortex organization; autism risk gene"
"Adora1","GPCR","Gi-coupled adenosine receptor; inhibits adenylyl cyclase; mediates neuroprotection and synaptic depression; regulates hippocampal neurogenesis; purinergic neuromodulation","Gi/Gnai2; adenylyl cyclase","plasma membrane","brain; bone; kidney; adipose; heart","neurons; astrocytes; osteoblasts; renal tubular cells","Gi/cAMP signaling; adenosine/purinergic signaling; hippocampal synaptic depression; neurogenesis regulation; bone remodeling","increased anxiety; abnormal body temperature; abnormal respiratory mechanics; abnormal CNS synaptic transmission; hyperalgesia; abnormal excitatory PSPs; increased kidney susceptibility to ischemia-reperfusion","moderate","increased anxiety; abnormal CNS transmission; hyperalgesia; decreased synaptic depression","glioma (expression-associated with epilepsy in glioma patients)",NA,"not a cancer driver","epilepsy (expressed at glioma-epilepsy interface); pain; ischemic injury; depression (hippocampal neurogenesis regulation)","modulates hippocampal neurogenesis quiescence","Gi-coupled adenosine A1 receptor mediating synaptic depression, neuroprotection, and anti-nociception; KO increases anxiety and disrupts CNS synaptic transmission"
"Lrrtm3","adhesion molecule","postsynaptic adhesion molecule promoting excitatory presynaptic differentiation; interacts with neurexin (requires heparan sulfate) and LAR-RPTPs; regulates dendritic spine density and excitatory synapses in dentate gyrus","NRXN1/2/3 (heparan sulfate-modified); LAR-RPTPs; PSD-95","postsynaptic membrane","brain (hippocampus, dentate gyrus)","neurons (dentate gyrus granule cells)","synaptogenesis; excitatory synapse development; neurexin-LRRTM signaling","abnormal CNS synaptic transmission; abnormal action potential; decreased paired-pulse facilitation; decreased excitatory PSC amplitude; decreased dendritic spine density","mild-moderate","abnormal CNS transmission; decreased paired-pulse facilitation; decreased excitatory PSC amplitude; decreased dendritic spine density","dentate gyrus granule neuron excitatory synapse development","neuroblastoma (prognostic expression)","expression-based neuroblastoma prognostic signature (not functional)","late-onset Alzheimer disease (GWAS; LRRTM3 haplotype association); autism spectrum disorder (LRR variant association)","essential for excitatory synapse development of dentate gyrus granule neurons","Postsynaptic LRR adhesion molecule required for excitatory synapse development of hippocampal dentate gyrus granule neurons via neurexin-heparan sulfate interaction; GWAS-linked to late-onset Alzheimer disease"
"Rtn4r","receptor","receptor for RTN4/Nogo-A, OMG, MAG, chondroitin sulfate proteoglycans, and gangliosides GT1b/GM1; signals via NGFR co-receptor to activate Rho and inhibit axon growth; new evidence for BAI adhesion-GPCR ligand activity","RTN4/Nogo-A; OMG; MAG; NGFR; BAI1/2/3 (BAI adhesion-GPCRs)","plasma membrane","brain; spinal cord","neurons; oligodendrocytes","Rho/ROCK signaling; axon regeneration inhibition; myelin inhibition; postnatal brain development; corpus callosum formation","impaired coordination; decreased exploration; enhanced CNS regeneration; abnormal axon extension; abnormal spatial learning; abnormal social behavior","moderate","impaired coordination; enhanced CNS regeneration after injury; abnormal axon extension; abnormal spatial learning; abnormal social behavior","implicated in cerebellar circuit formation through Nogo/myelin signaling context",NA,"not established as cancer driver","schizophrenia (22q11 candidate gene; myelin-inhibition signaling); CNS ischemia","mediates myelin-dependent inhibition of axonal sprouting; required for corpus callosum formation","Nogo/RTN4 receptor mediating myelin-dependent inhibition of axon regeneration; KO enhances CNS axon regeneration; postnatal brain development role; schizophrenia candidate"
"Prkce","kinase","calcium-independent DAG/phospholipid-dependent serine/threonine kinase; phosphorylates MARCKS, vimentin, KRT8, ITGB1; regulates cell adhesion, migration, apoptosis, ion channels, and neuron growth","MARCKS; vimentin; KRT8; ITGB1; PTK2/FAK","cytoplasm; plasma membrane; nucleus","brain; heart; immune cells; testis","neurons; cardiomyocytes; macrophages; T cells","PKC signaling; integrin signaling; cytoskeletal regulation; apoptosis; neuronal growth","decreased TNF secretion; decreased body size; increased susceptibility to bacterial infection; increased myocardial infarct size; decreased macrophage apoptosis; decreased NK cell number","moderate","implicated in neuronal growth and ion channel regulation (functional studies); SHORT syndrome neurological phenotype with PRKCE mutation",NA,"non-Hodgkin's lymphoma (methylation); medulloblastoma (miR-129 target network); prostate cancer","context-dependent; targeted by miR-129 in MB; methylation-altered in B-cell lymphomas","SHORT syndrome (novel PRKCE mutation with intellectual disability); Parkinson disease (LRRK2-PAK6 network)","regulates neurite outgrowth and neuronal differentiation downstream of PKC signaling","Calcium-independent PKC isoform regulating neuronal growth, cytoskeletal dynamics, and ion channels; novel mutations cause SHORT syndrome with intellectual disability; targeted by miR-129 in medulloblastoma"
"Gpr158","GPCR","atypical metabotropic glycine receptor; recruits and regulates RGS7-GNB5 complex instead of activating G proteins; controls cAMP levels; regulates synapse formation; acts as osteocalcin receptor for bone-brain signaling","RGS7-GNB5 complex; G protein alpha subunits; GPC4 (glypican 4, extracellular cis-ligand)","plasma membrane; postsynaptic density","brain; prostate; retina","neurons (prefrontal cortex, hippocampus); Purkinje cells","RGS7/Gi signaling; cAMP regulation; synaptogenesis; bone-brain axis (osteocalcin signaling); GnRH neuron regulation","decreased anxiety; abnormal neuron morphology; decreased stress-induced hyperthermia; enhanced AMPA-mediated currents; increased dendritic spine density; increased EPSC frequency; decreased depression-related behavior","mild-moderate","decreased anxiety; abnormal glutamatergic neuron morphology; enhanced AMPA currents; increased spine density; decreased depression-like behavior","GPR158 expressed in cerebellar Purkinje cells; involved in synaptic organization","prostate cancer (androgen-regulated; loss promotes castration resistance); glioma (expression-associated)","GPR158 loss promotes castration-resistant prostate cancer; expression altered in glioma","Alzheimer disease (expression association); depression (GPR158 regulates glucocorticoid-induced depression circuits); intraocular pressure regulation","mediates osteocalcin effects on neuronal proliferation and differentiation; regulates synapse formation","Atypical GPCR acting as glycine/osteocalcin receptor that recruits RGS7-GNB5 to regulate cAMP and synaptic AMPA currents; KO decreases anxiety and increases dendritic spines; expressed in cerebellar Purkinje cells"
"Slitrk4","adhesion molecule","transmembrane LRR adhesion molecule; suppresses neurite outgrowth; promotes synapse differentiation; organizes inhibitory synapses (inferred from family)",NA,"plasma membrane","brain (olfactory bulb, amygdala)","neurons","synaptogenesis; LAR-RPTP signaling; synaptic organization","decreased exploration; abnormal amygdala morphology; enhanced LTP; decreased aggression; abnormal brain interneuron morphology; abnormal synaptic plasticity; decreased prepulse inhibition; decreased social investigation; abnormal olfactory behavior","moderate","decreased exploration; abnormal amygdala morphology; enhanced LTP; decreased prepulse inhibition; abnormal synaptic plasticity; decreased social investigation",NA,"leiomyosarcoma (expression screen); hypertrophic cardiomyopathy (expression screen)","expression altered in sarcoma and HCM screens (not functional)","neuropsychiatric disorders (SLITRK family association); Fragile X syndrome (network)","suppresses neurite outgrowth; promotes synapse differentiation","Transmembrane LRR adhesion molecule abundant in amygdala and olfactory bulb that suppresses neurite outgrowth and promotes synapse differentiation; KO mice show enhanced LTP and abnormal social and olfactory behavior"
"Gpr68","GPCR","proton/pH-sensing Gq-coupled receptor; responds to acidosis; mediates shear stress mechanosensing in endothelium; regulates cAMP via IP3/DAG; synaptic proton signaling; osteoblast pH sensor","Gq; phospholipase C; diacylglycerol; IP3","plasma membrane","brain; vasculature; bone; adipose; hematopoietic system","hippocampal neurons; endothelial cells; osteoblasts; macrophages; hematopoietic stem cells","Gq/PLC/IP3 signaling; proton-sensing; mechanosensing; hippocampal LTP; bone acid sensing; cAMP regulation","decreased circulating glucagon; decreased insulin; increased insulin sensitivity; abnormal osteoclast differentiation; decreased tumor growth; increased monocytes","mild-moderate","GPR68 promotes hippocampal LTP; proton-mediated synaptic modulation; neuroprotection in acidotic/ischemic conditions","expressed in hippocampus; mediates proton signaling for LTP",NA,"decreased tumor growth in KO; possible tumor-suppressive role via microenvironment pH sensing","depression; Alzheimer disease; neurofibromatosis (NF1 Schwann cell context); glaucoma (intraocular pressure)","expressed during hippocampal neurogenesis context (functional relationship unclear)","Proton/pH-sensing Gq-GPCR expressed in hippocampus mediating acid-induced synaptic modulation and LTP; also an endothelial mechanosensor; linked to depression and Alzheimer disease"
"Flrt1","adhesion molecule","type I transmembrane LRR protein; potentiates FGFR1-mediated MAP kinase signaling; mediates cell-cell adhesion and repulsion via latrophilin (ADGRL1/3) and Unc5 interactions; regulates cortical neuron migration and cortical folding","FGFR1; ADGRL1/ADGRL3; Unc5D","plasma membrane; extracellular space (shed ectodomain)","brain (cortex); kidney","cortical neurons; kidney cells","FGF/FGFR/MAPK signaling; cell-cell adhesion; cortical neuron migration; cortical folding","no abnormal phenotype detected (single KO); cortical folding when combined with FLRT3 KO","mild (single KO)","combined FLRT1/FLRT3 KO causes cortical folding (sulci formation) due to increased lateral neuron dispersion","FLRT1 expressed in kidney and brain; role in cerebellar context not established","pediatric high-grade glioma (H3K27M context, expression screen)","expression altered in H3K27M DIPG/pHGG (screen, not functional)",NA,"promotes neurite outgrowth via FGFR1/MAPK; regulates cortical neuron migration speed and adhesion during cortical development","Transmembrane LRR-FnIII adhesion molecule that potentiates FGFR1/MAPK signaling and mediates cortical neuron migration; combined loss with FLRT3 causes cortical folding"
"Rapgef4","GTPase/regulator","cAMP-activated GEF (EPAC2) for RAP1A, RAP1B, RAP2A; mediates cAMP/PKA-independent exocytosis via RIMS2 interaction; regulates insulin secretion and cardiac function","RAP1A; RAP1B; RAP2A; RIMS2","cytoplasm; plasma membrane","pancreatic islets; heart; brain; adipose","beta cells; cardiomyocytes; neurons","cAMP/EPAC/RAP1 signaling; insulin exocytosis; synaptic vesicle exocytosis; cardiac calcium homeostasis","abnormal insulin secretion; ventricular tachycardia; decreased circulating calcium; thrombocytopenia; decreased fasting glucose","moderate",NA,"expressed in brain; role in cAMP-dependent synaptic exocytosis via RIMS2 interaction","glioma (EPAC signaling context); melanoma (cAMP/EPAC differential response)","cAMP-EPAC signaling mediates differential melanoma cell growth response; altered in glioma (not functional)",NA,"mediates cAMP-PKA-independent exocytosis downstream signals relevant to neuronal secretion","cAMP-activated RAP1-GEF (EPAC2) that links cAMP signals to RAP1 activation and exocytosis; regulates insulin secretion; KO shows cardiac arrhythmia and impaired insulin secretion"
"Syt12","other","synaptic vesicle phosphoprotein; enhances spontaneous neurotransmitter release without affecting evoked release; Ca2+-independent (no Ca2+ or phospholipid binding); required for mossy-fiber LTP",NA,"synaptic vesicle","brain (hippocampus, cerebellum)","neurons","spontaneous neurotransmitter release; mossy-fiber LTP; thyroid hormone-regulated gene program",NA,NA,"essential for mossy-fiber LTP in hippocampus; expressed in cerebellum (thyroid hormone-regulated)","Syt12 is thyroid hormone-regulated in cerebellum and expressed in cerebellar context",NA,"not a cancer driver","ADHD (genetic association); aging-related cognitive decline (hippocampal proteome)","thyroid hormone-regulated expression during cerebellar development","Ca2+-independent synaptotagmin that enhances spontaneous neurotransmitter release and is required for mossy-fiber LTP; thyroid hormone-regulated during cerebellar development"
"Sorl1","receptor","multi-ligand sorting receptor; directs APP to trans-Golgi/prevents amyloid-beta generation; sorts NTRK2/TrkB for BDNF signaling; sorts GDNF; interacts with retromer complex for endosomal cargo trafficking","APP; NTRK2/TrkB; GDNF; LDL","trans-Golgi network; endolysosomes; retromer complex","brain; vasculature; kidney","neurons; astrocytes; microglia; endothelial cells","endosomal sorting; APP/amyloid-beta trafficking; retromer complex; BDNF/NTRK2 signaling; GDNF secretion","amyloid beta deposits; abnormal object recognition memory; neuron degeneration; tau deposits; impaired spatial learning; abnormal cholinergic neuron morphology; abnormal gait","severe (neural)","amyloid deposits; neuron degeneration; tau deposits; impaired spatial learning; cholinergic neuron loss; abnormal gait","expressed and functional in brain neurons; KO causes neurodegeneration and cognitive impairment",NA,"not established as cancer driver","Alzheimer disease (strong genetic risk locus; loss-of-function variants causative; endosomal trafficking mechanism); vascular dementia","controls APP trafficking and amyloid-beta production; regulates BDNF receptor recycling critical for neuron survival","Endosomal sorting receptor that retains APP in trans-Golgi to prevent amyloid-beta generation and routes NTRK2 for BDNF signaling; loss-of-function variants causally implicated in Alzheimer disease"
"Vamp8","other","R-SNARE mediating autophagosome-lysosome fusion (with STX17-SNAP29); required for dense-granule secretion in platelets; mediates zymogen granule exocytosis in pancreatic acinar cells; involved in interferon antiviral response","STX17; SNAP29; STX7; YKT6; TRIM6","autophagosome; lysosome; secretory granule; midbody","pancreas; platelets; brain; mammary gland","acinar cells; platelets; neurons; mast cells; dendritic cells","autophagy (autophagosome-lysosome fusion); SNARE-mediated exocytosis; antiviral interferon signaling; endosome fusion","abnormal mast cell degranulation; abnormal pancreas secretion; decreased susceptibility to pancreatitis; abnormal pancreatic acinar zymogen granules; postnatal lethality (incomplete)","moderate","not described in neural-specific studies; autophagy role likely in neurons","not specifically demonstrated","glioblastoma (autophagy-radioresistance); lung cancer (exosome secretion)","VAMP8-dependent autophagy promotes GBM radioresistance; VAMP8 mediates tumor exosome secretion in NSCLC",NA,"mediates autophagosome-lysosome fusion relevant to neuronal protein degradation","R-SNARE essential for autophagosome-lysosome fusion and regulated exocytosis; promotes glioblastoma radioresistance via autophagy; mediates platelet dense-granule and pancreatic acinar secretion"
