"gene","protein_class","molecular_action","key_substrates","subcellular","tissues","cell_types","pathways","ko_phenotype","ko_severity","neural_phenotype","cerebellar_evidence","cancer_types","cancer_role","neuro_disease","differentiation_role","one_line_summary"
"Slc9a3r2","scaffold/adaptor","scaffolds PDZ-domain interactions at apical membrane; regulates NHE3 and CFTR activity via PDZ binding","NHE3, CFTR, PTEN, beta2-adrenergic receptor","plasma membrane, apical membrane","kidney, intestine, inner ear, breast","epithelial cells, hair bundle stereocilia","Wnt, CFTR signaling","reduced NHE3-mediated sodium transport; intestinal defects; hearing loss","viable",NA,"no","breast cancer (bioinformatic association only)","biomarker only",NA,"none known","SLC9A3R2 is a PDZ-domain scaffold protein that anchors transporters including NHE3 and CFTR to the apical membrane and regulates their activity in epithelial tissues."
"D17H6S56E-3","other","unknown; possibly phosphatidylcholine-specific phospholipase C activity (predicted)","phosphatidylcholine",NA,NA,NA,NA,"unknown","unknown",NA,"no",NA,"unknown",NA,"none known","D17H6S56E-3 (VWA7 homolog) is a poorly characterized gene with predicted phosphatidylcholine-specific phospholipase C activity based on structural homology, but functional data remain absent."
"Spnb4","structural protein","organizes membrane-cytoskeleton interface at nodes of Ranvier and axon initial segments; stabilizes voltage-gated ion channels","AnkyrinG, voltage-gated sodium channels, KCNQ2/3, Nav1.6","plasma membrane, axon initial segment, nodes of Ranvier","brain, peripheral nerve, skeletal muscle, testis","neurons, Schwann cells, skeletal muscle cells",NA,"neurodevelopmental disorder (NEDHND): hypotonia, peripheral neuropathy, deafness, occasional seizures; male mice develop normally but show neuropathy","viable","peripheral neuropathy, hypotonia, infrequent seizures","no",NA,"none","NEDHND (neurodevelopmental disorder with hypotonia, neuropathy, and deafness)","none known","SPTBN4/spectrin-beta4 is a cytoskeletal scaffolding protein that organizes the axon initial segment and nodes of Ranvier, and whose loss-of-function mutations in humans cause a recessive neurodevelopmental disorder with hypotonia, neuropathy, and deafness."
"Odz1","other","mediates homophilic and heterophilic cell-cell adhesion; regulates axon guidance, synaptogenesis, and circuit wiring; nuclear translocation promotes GBM invasion","teneurin family members, contactin, latrophilin (ADGRL)","plasma membrane, extracellular matrix, nucleus (in GBM)","brain, reproductive tract","neurons, glioblastoma stem-like cells","Wnt/PCP, EMX2-HOXA10 axis","reduced connectivity of callosal and subcortical projections; altered limbic circuit formation","viable","impaired axonal connectivity, altered limbic system wiring","no","glioblastoma (functional: promotes invasion)","oncogene",NA,"none known","ODZ1/TENM1 is a type-II transmembrane protein that mediates homophilic cell adhesion and axon guidance during brain development, and promotes invasion of glioblastoma stem-like cells through nuclear translocation."
"BC096441","other","unknown",NA,NA,NA,NA,NA,"unknown","unknown",NA,"no",NA,"unknown",NA,"none known","BC096441 is an uncharacterized mouse cDNA sequence with no abstracts and no known molecular function."
"2310015B20Rik","other","unknown; gene symbol matches DWORF (dwarf open reading frame), a micropeptide that activates SERCA by displacing inhibitory regulators","SERCA (sarco/endoplasmic reticulum Ca2+-ATPase)","sarcoplasmic reticulum membrane","skeletal muscle, heart","muscle cells, cardiomyocytes","calcium signaling","unknown","unknown",NA,"no",NA,"unknown",NA,"none known","2310015B20Rik likely encodes DWORF, a short transmembrane micropeptide expressed in muscle that activates SERCA by displacing inhibitory regulators, thereby promoting calcium reuptake into the sarcoplasmic reticulum."
"Ctgf","secreted factor","binds integrins and heparan sulfate proteoglycans to promote cell adhesion, matrix production, angiogenesis, fibrosis, and osteoblast/chondrocyte differentiation; modulates TGF-beta and BMP signaling","integrins (alpha-v-beta-3, alpha-5-beta-1), TGF-beta, BMP2/4, VEGF, heparan sulfate proteoglycans","extracellular matrix, plasma membrane","connective tissue, vascular wall, bone, cartilage, eye, tendon","fibroblasts, chondrocytes, osteoblasts, endothelial cells, myofibroblasts","TGF-beta/SMAD, BMP, Wnt, YAP/TAZ","embryonic lethal due to skeletal defects (craniofacial and long bone); corneal defects in conditional KO","embryonic lethal",NA,"yes (expressed in eye/retina, neural retina; Muller glia in adult)","breast cancer, hepatocellular carcinoma, colorectal cancer (fibrosis/tumor stroma context)","biomarker only",NA,"promotes (osteoblast, chondrocyte, fibroblast differentiation)","CCN2/CTGF is a cysteine-rich secreted matricellular protein that modulates TGF-beta and integrin signaling to drive fibrosis, angiogenesis, and osteoblast/chondrocyte differentiation in multiple tissues."
"Phf15","other","component of LSD1/NuRD chromatin repressor complex; contains PHD finger that reads histone methylation marks; required for hippocampal synaptic plasticity and cognitive function","LSD1, NuRD complex, histone H3","nucleus","brain, embryonic stem cells","neurons (hippocampus), stem cells","LSD1/HDAC axis, neural differentiation","impaired hippocampal LTP; cognitive deficits; altered ESC differentiation toward neural lineage","viable","impaired synaptic plasticity, cognitive deficits","no","pediatric brain tumors (bioinformatic association only)","biomarker only","cognitive impairment","required for (neural lineage differentiation from ESCs; synaptic plasticity maintenance)","PHF15/JADE2 is a PHD finger protein that functions within the LSD1/NuRD chromatin repressor complex and is required for maintaining hippocampal synaptic plasticity and cognitive function in mice."
"Sept4","GTPase/regulator","forms septin filament scaffolds at diffusion barriers; pro-apoptotic isoform ARTS localizes to mitochondria and promotes caspase activation by antagonizing XIAP; structural role in sperm annulus","XIAP, SEPT2, SEPT6, SEPT7, SEPT12, caspase pathway components","cytoplasm, mitochondria (ARTS isoform), sperm annulus, plasma membrane","testis, intestine, platelets, neurons, liver","spermatocytes, intestinal stem cells, neurons, platelets","apoptosis (caspase), Wnt (stem cell niche)","male sterility (immotile structurally defective sperm; absent annulus); increased intestinal stem cell numbers due to defective ARTS-mediated apoptosis","viable",NA,"no","leukemia, lymphoma (ARTS isoform as tumor suppressor)","tumor suppressor",NA,"inhibits (stem cell self-renewal; promotes apoptotic elimination of stem cells)","SEPT4 encodes both a cytoskeletal septin that forms the sperm annulus and the pro-apoptotic ARTS isoform that promotes stem cell elimination by antagonizing XIAP, with loss causing male infertility and expanded intestinal stem cell pools."
"Fam101b","structural protein","binds filamin-A/B and regulates actin filament network architecture; controls perinuclear actin bundle (TAN line) formation for nuclear positioning","filamin-A, filamin-B, actin","cytoplasm, perinuclear actin network","fibroblasts, cartilage, bone","fibroblasts, chondrocytes, osteoblasts","actin cytoskeleton, mechanotransduction","skeletal malformations (cartilage/bone defects); similar to filamin-B loss-of-function phenotypes","viable",NA,"no",NA,"none",NA,"required for (skeletal morphogenesis, chondrocyte differentiation)","FAM101B/refilin-B is a filamin-binding protein that acts as a molecular switch to reorganize the cortical actin network into contractile bundles, thereby regulating nuclear positioning and skeletal morphogenesis."
"Spnb1","structural protein","links membrane proteins (anion exchanger, glycophorin) to the spectrin-actin cytoskeleton in erythrocytes; also expressed in neurons as a cytoskeletal organizer","ankyrin, protein 4.1, anion exchanger (Band 3), actin","plasma membrane, cytoskeleton","erythrocytes, brain","red blood cells, neurons",NA,"hereditary spherocytosis (erythrocyte fragility, hemolytic anemia); neural isoforms critical for neuronal polarity","viable",NA,"no","esophageal squamous cell carcinoma (bioinformatic association only)","biomarker only",NA,"none known","SPTBN1/spectrin-beta1 is the major erythrocyte spectrin that links the plasma membrane to the actin cytoskeleton, and whose mutations cause hereditary spherocytosis; neuronal isoforms additionally organize axonal membrane domains."
"4933426M11Rik","other","unknown; gene symbol maps to SUSD6 region; SUSD6 is a negative regulator of MHC-I antigen presentation","MHC-I complex, TMEM127, WWP2","plasma membrane","immune cells, melanoma cells","T cells, AML cells","NF-kB, MHC-I antigen presentation","reduced MHC-I surface expression when overexpressed; immune evasion","unknown",NA,"no","AML, melanoma (functional: negative regulator of MHC-I)","biomarker only",NA,"none known","4933426M11Rik (likely SUSD6 homolog) encodes a transmembrane protein that negatively regulates MHC-I surface expression, thereby contributing to immune evasion in cancer."
"1110018J18Rik","other","unknown",NA,NA,NA,NA,NA,"unknown","unknown",NA,"no",NA,"unknown",NA,"none known","1110018J18Rik is an uncharacterized RIKEN cDNA with no abstracts and no known molecular function."
"2010300C02Rik","other","unknown",NA,NA,NA,NA,NA,"unknown","unknown",NA,"no",NA,"unknown",NA,"none known","2010300C02Rik is an uncharacterized RIKEN cDNA with no abstracts and no known molecular function."
"Adck3","kinase","atypical kinase required for coenzyme Q10 (ubiquinone) biosynthesis in mitochondria; activates the CoQ biosynthesis complex; regulates electron transport chain function","CoQ biosynthesis intermediates, COQ complex components","mitochondria, inner mitochondrial membrane","cerebellum, skeletal muscle, ubiquitous","Purkinje neurons, cerebellar neurons, muscle cells","mitochondrial OXPHOS, CoQ biosynthesis","cerebellar atrophy; Purkinje neuron degeneration (dark cell degeneration); altered electrophysiology; exercise intolerance; progressive ataxia","viable","cerebellar ataxia, Purkinje neuron degeneration, exercise intolerance","yes (cerebellar Purkinje neuron degeneration and electrophysiological changes in Coq8a-null mice)",NA,"none","COQ8A-ataxia (autosomal recessive cerebellar ataxia type 2, ARCA2; primary CoQ10 deficiency-4)","none known","ADCK3/COQ8A is a mitochondrial atypical kinase essential for coenzyme Q10 biosynthesis whose mutations cause autosomal recessive cerebellar ataxia with progressive Purkinje neuron degeneration."
"Ssfa2","other","unknown; sperm-specific antigen; may function as a scaffold or signaling mediator; upregulated in glioma and prostate cancer and promotes proliferation/invasion when overexpressed","miR-877-5p (regulatory), NA","cytoplasm","sperm, glioma tissue, prostate","spermatocytes, glioma cells, prostate cancer cells",NA,"unknown","unknown",NA,"no","glioma, prostate cancer (functional: promotes proliferation and invasion in cell lines)","oncogene",NA,"none known","SSFA2 is a sperm-specific antigen of unknown molecular function that is upregulated in glioma and prostate cancer, where it promotes cell proliferation and invasion."
"Epb4.1l1","structural protein","links plasma membrane proteins to spectrin-actin cytoskeleton; organizes membrane domains; mediates mechanical stability at the cortical membrane; also regulates MAST3 kinase interactions","spectrin, ankyrin, glycophorin, MAST3, Numb","plasma membrane, cytoskeleton, nucleus (alternative isoforms)","brain, erythrocytes, muscle","neurons, red blood cells","cytoskeletal signaling, MAST3 pathway","growth retardation, feeding difficulties, gastroesophageal reflux (from 20q11.2 deletion including EPB41L1); neural defects","viable","neurodevelopmental delay (from chromosomal deletion context)","no","glioblastoma (bioinformatic association only)","biomarker only","neurodevelopmental delay (20q11.2 deletion syndrome)","none known","EPB41L1/4.1N is a brain-enriched member of the protein 4.1 family that links membrane receptors and ion channels to the spectrin-actin cytoskeleton in neurons, and whose chromosomal deletion contributes to a syndrome with growth retardation and neurodevelopmental delay."
"Tmem56","other","transmembrane protein involved in haem biosynthesis and cell cycle progression during erythropoiesis","haem biosynthesis enzymes (context), NA","plasma membrane, intracellular membranes","erythroid cells, heart","erythroid progenitors, cardiomyocytes","haem biosynthesis, erythropoiesis","impaired erythroid differentiation (knockdown in CD34+ cells causes haem biosynthesis defects and cell cycle arrest)","unknown",NA,"no","AML (bioinformatic association only)","biomarker only",NA,"required for (erythroid differentiation)","TMEM56 is a transmembrane protein abundantly expressed in erythroid cells that is required for haem biosynthesis and cell cycle progression during erythropoiesis."
"Cyr61","secreted factor","matricellular protein secreted into ECM; activates integrins and heparin sulfate proteoglycans to promote cell adhesion, migration, proliferation, angiogenesis, apoptosis resistance, and wound healing","integrins (alpha-v-beta-3, alpha-6-beta-1), heparan sulfate proteoglycans, CD44, TNF receptor","extracellular matrix, plasma membrane","vascular tissue, bone, kidney, skin, brain (astrocytes)","fibroblasts, endothelial cells, osteoblasts, astrocytes, macrophages","YAP/TAZ, TGF-beta, Wnt, NF-kB","bone-specific KO shows reduced bone density, impaired osteogenic differentiation; global KO is embryonic lethal due to placental and cardiovascular defects","embryonic lethal",NA,"yes (expressed in astrocytes; involved in astrocyte-mediated regulation of cortical plasticity)","ovarian cancer, breast cancer (functional context); multiple bioinformatic associations","biomarker only",NA,"promotes (osteoblast differentiation, wound healing, astrocyte function)","CYR61/CCN1 is a secreted matricellular protein that activates integrin signaling to promote angiogenesis, wound healing, and osteogenic differentiation, and whose astrocyte-specific expression contributes to regulation of cortical circuit plasticity."
"Epb4.1l4b","structural protein","links plasma membrane to actin cytoskeleton; regulates apical-basal cell polarity and tight junction integrity; suppresses cell proliferation when expressed in normal epithelium","filamin, NF2/ezrin-radixin-moesin family, CD44","plasma membrane, cortical cytoskeleton","epithelium, placenta, prostate","epithelial cells, prostate cancer cells","Hippo/NF2, cell polarity","altered cell polarity and tight junction organization; increased proliferation in vitro when lost","viable",NA,"no","breast cancer, colorectal cancer, prostate cancer (EPB41L4B/Ehm2 overexpressed in metastatic cells; functional role debated)","tumor suppressor",NA,"none known","EPB41L4B/Ehm2 is a 4.1-superfamily scaffold that maintains apical-basal polarity and suppresses proliferation in epithelial cells, with overexpression observed in metastatic cancer cells where its role as tumor suppressor or pro-metastatic factor remains debated."
"1520402A15Rik","scaffold/adaptor","PDZ domain-containing adaptor related to MYO18A complex; regulates Wnt/PCP signaling and cytoskeletal organization; possible role in gastrulation and muscle integrity","MYO18A, LURAP1, MRCK, PAK2, betaPIX, GIT1, Dishevelled","cytoplasm, plasma membrane","muscle, embryonic tissues","myofibers, epithelial cells","Wnt/PCP, actin cytoskeleton","unknown in mammals; zebrafish orthologs required for muscle integrity and gastrulation","unknown",NA,"no","uveal melanoma (bioinformatic association only)","biomarker only",NA,"none known","1520402A15Rik encodes a putative PDZ-domain scaffold related to the MYO18A/LURAP1/MRCK complex that regulates Wnt/PCP-dependent cytoskeletal organization during gastrulation and muscle morphogenesis."
"Agpat9","enzyme","catalyzes acylation of lysophosphatidic acid to phosphatidic acid (second step of de novo glycerolipid synthesis) in the endoplasmic reticulum; same enzyme as GPAT3","lysophosphatidic acid, acyl-CoA","endoplasmic reticulum membrane","adipose tissue, epidermis, liver","adipocytes, keratinocytes, hepatocytes","lipid biosynthesis, seipin/lipodystrophy pathway, adipogenesis","reduced lipid droplet formation; contributes to lipodystrophy when combined with seipin loss","viable",NA,"no","hepatocellular carcinoma (bioinformatic/metabolic association only)","biomarker only",NA,"promotes (adipocyte differentiation)","AGPAT9/GPAT3 is an endoplasmic reticulum acyltransferase that catalyzes the rate-limiting step in glycerolipid biosynthesis and is highly induced during adipogenesis to drive lipid droplet formation."
"Gm996","other","unknown predicted gene; abstracts are dominated by PAR-3/polarity and C. elegans cell junction papers; may share genomic locus with a cell polarity or junction gene",NA,NA,NA,NA,NA,"unknown","unknown",NA,"no",NA,"unknown",NA,"none known","Gm996 is a mouse predicted gene of unknown function whose associated literature concerns cell polarity and junction biology in C. elegans, suggesting possible evolutionary conservation of a cell junction or polarity role."
"2210411K11Rik","other","unknown RIKEN cDNA; no functional data available",NA,NA,NA,NA,NA,"unknown","unknown",NA,"no",NA,"unknown",NA,"none known","2210411K11Rik is an uncharacterized RIKEN cDNA with minimal literature and no known molecular function."
"St5","other","unknown function; ""suppression of tumorigenicity 5"" designation; abstracts are entirely unrelated (bacterial typing, sepsis); no functional data on the actual gene product",NA,NA,NA,NA,NA,"unknown","unknown",NA,"no",NA,"unknown",NA,"none known","ST5 (suppression of tumorigenicity 5) is a poorly characterized gene that was named for its chromosomal locus on 11p15 but lacks functional characterization, and the available literature does not provide mechanistic insight into its molecular activity."
"AI118078","channel regulator","voltage-sensor domain protein lacking a pore; senses membrane potential in cerebellar granule cells; proposed to regulate voltage-gated channel activity or vesicle fusion via voltage-dependent conformational changes","unknown effectors; possibly interacts with voltage-gated channels","plasma membrane","cerebellum","cerebellar granule cells","voltage sensing, cerebellar signaling","unknown","unknown",NA,"yes (TMEM266/AI118078 is expressed specifically in cerebellar granule cells)","upper tract urothelial carcinoma (bioinformatic only)","biomarker only",NA,"none known","AI118078/TMEM266 is a voltage-sensing protein expressed in cerebellar granule neurons that, despite lacking an ion-conducting pore domain, responds to membrane potential changes and may regulate electrical signaling in the cerebellum."
"Slc24a6","transporter","mitochondrial sodium/calcium exchanger (NCLX-related); mediates Ca2+ efflux from mitochondria in exchange for Na+; regulates mitochondrial calcium homeostasis in neurons; expressed in brain after stroke","Ca2+, Na+","mitochondrial inner membrane","brain, heart","neurons, cardiomyocytes","mitochondrial calcium signaling, neurodegeneration pathway","neuronal mitochondrial calcium overload; metabolic derangement; cognitive decline (inferred from related NCLX studies)","unknown","cognitive decline, mitochondrial calcium overload","no",NA,"none","Alzheimer's disease, ischemic stroke, neuropsychiatric disease","none known","SLC24A6 is a brain-enriched mitochondrial sodium/calcium exchanger that mediates calcium efflux from neuronal mitochondria, and whose disruption contributes to calcium overload and neurodegeneration in ischemia and Alzheimer's disease models."
"Fam5c","secreted factor","secreted myokine that promotes osteoblast differentiation and bone anabolic activity; expressed in skeletal muscle and acts in a muscle-to-bone crosstalk axis; also called BRINP3","BMP receptors (inferred), osteoblast differentiation regulators","secreted, extracellular","skeletal muscle, bone","osteoblasts, muscle cells, neural stem cells","BMP signaling, neural differentiation, bone anabolic pathway","unknown in vivo KO; in vitro knockdown reduces osteoblast differentiation","unknown",NA,"no","osteosarcoma (bioinformatic association only)","biomarker only",NA,"promotes (osteoblast differentiation, neural stem cell differentiation)","FAM5C/BRINP3 is a secreted myokine produced by skeletal muscle that promotes osteoblast differentiation through muscle-bone crosstalk, and is also expressed in neural tissues where it may regulate neural stem cell differentiation."
"A430110N23Rik","other","secreted glycoprotein of the scavenger receptor cysteine-rich (SRCR) superfamily (S5D-SRCRB); binds conserved microbial cell wall components and possibly endogenous proteins; restricted tissue expression","microbial cell wall components, endogenous proteins (unspecified)","secreted, extracellular, plasma membrane","liver, immune tissues","macrophages, liver cells","innate immune signaling","unknown","unknown",NA,"no","hepatocellular carcinoma (bioinformatic association only)","biomarker only",NA,"none known","A430110N23Rik/S5D-SRCRB is a secreted glycoprotein of the SRCR superfamily with restricted tissue expression that binds conserved microbial molecules and may participate in innate immune pattern recognition."
"3632451O06Rik","other","unknown; abstracts describe ARMH4 (armadillo-like helical domain containing 4), an uncharacterized protein that localizes during heart morphogenesis and whose loss accelerates aging-related phenotypes",NA,"intracellular, nucleus (inferred)","heart, broad expression","cardiomyocytes, aging tissues","aging pathways","premature aging phenotypes (early death, organ degeneration) in whole-body Armh4 KO mice","viable (premature death)",NA,"no",NA,"none",NA,"none known","3632451O06Rik likely corresponds to Armh4, an armadillo-domain protein expressed during heart morphogenesis whose loss-of-function in mice accelerates aging-associated organ degeneration and reduces lifespan."
"E330009J07Rik","other","unknown RIKEN cDNA; single abstract is a psychiatric genetics study associating peripheral blood gene expression with psychiatric phenotypes; no functional characterization",NA,NA,NA,NA,NA,"unknown","unknown",NA,"no",NA,"unknown","psychiatric phenotypes (expression association)","none known","E330009J07Rik is an uncharacterized RIKEN cDNA whose single abstract reports an association between its peripheral blood expression and psychiatric phenotypes, but provides no mechanistic insight."
"Darc","receptor","atypical chemokine receptor (ACKR1) that binds multiple chemokines without G-protein coupling; acts as chemokine sink/decoy to regulate chemokine gradient; expressed on erythrocytes and endothelium; also serves as Plasmodium vivax invasion receptor","CXCL1, CXCL2, CXCL5, CXCL7, CXCL8, CCL2, CCL5, CCL7, CCL11, CXCL13; Plasmodium vivax Duffy binding protein","plasma membrane, erythrocytes, endothelium","bone marrow, liver, spleen, kidney, lung","erythrocytes, endothelial cells, neutrophils","chemokine signaling, inflammation, ACKR decoy axis","neutropenia (ADAN: ACKR1/DARC-associated neutropenia) in individuals of African descent; impaired chemokine clearance; increased susceptibility to P. vivax malaria","viable",NA,"no","multiple (bioinformatic association in liver fibrosis, adipose tissue, pancreatic cancer)","biomarker only",NA,"none known","DARC/ACKR1 is an atypical chemokine decoy receptor on erythrocytes and endothelium that scavenges multiple inflammatory chemokines without G-protein coupling, and whose loss causes benign neutropenia and increased susceptibility to Plasmodium vivax malaria."
"Fam126b","scaffold/adaptor","component of the PI4KIIIalpha lipid kinase complex (with FAM126A/hyccin, EFR3, TTC7); promotes PI(4)P production at the plasma membrane; paralog of FAM126A/hyccin; synthetic lethal with FAM126A loss in colorectal cancer","FAM126A, PI4KIIIalpha complex, EFR3, TTC7","plasma membrane, endoplasmic reticulum","brain, ubiquitous","oligodendrocytes, epithelial cells, colon cancer cells","PI4P/PI(4,5)P2 signaling, phosphoinositide metabolism","unknown KO phenotype; hypomyelination when FAM126A is lost (related paralog)","unknown","hypomyelination (inferred from FAM126A)","no","colorectal cancer (functional: FAM126B is a specific dependency in FAM126A-low CRC)","tumor suppressor","hypomyelination and congenital cataract (FAM126A mutations; FAM126B by inference)","none known","FAM126B is a PI4KIIIalpha complex scaffold that drives plasma membrane PI(4)P production and is a synthetic lethal vulnerability in colorectal cancers with low FAM126A expression."
"A230050P20Rik","other","unknown RIKEN cDNA; associated literature concerns SHFL (shiftless), an ISG that restricts viral replication, and CC2D1A, a scaffold involved in endolysosomal signaling; no direct functional data on this gene",NA,NA,NA,NA,NA,"unknown","unknown",NA,"no",NA,"unknown",NA,"none known","A230050P20Rik is an uncharacterized RIKEN cDNA whose co-cited literature concerns innate immune restriction of viruses and endolysosomal signaling, but no direct functional characterization of the gene product exists."
