"gene","protein_class","molecular_action","key_substrates","subcellular","tissues","cell_types","pathways","ko_phenotype","ko_severity","neural_phenotype","cerebellar_evidence","cancer_types","cancer_role","neuro_disease","differentiation_role","one_line_summary"
"Gpr84","GPCR","Pro-inflammatory GPCR for medium-chain fatty acids (C9-C14); activates AKT/ERK/NF-kB and NLRP3 inflammasome; promotes neutrophil chemotaxis; inhibits osteoclast formation","capric acid (C10:0); undecanoic acid (C11:0); lauric acid (C12:0); 6-OAU","plasma membrane","immune cells (macrophages; neutrophils); adipose; bone marrow; brain (microglia)","macrophages; monocytes; neutrophils; microglia","NF-kB/AKT/ERK pro-inflammatory signaling; NLRP3 inflammasome; fatty acid sensing; osteoclastogenesis","abnormal Th2 physiology; increased IL-13/IL-4/IL-5; increased ALT","mild",NA,"expressed in brain microglia; involved in tauopathy glial response","colorectal cancer; tumor microenvironment (various)","GPR84 in macrophages inhibits osteoclast-mediated bone metastasis of CRC; expressed in tumor-associated macrophages","neuroinflammation; tauopathy; sepsis",NA,"Pro-inflammatory fatty acid receptor on macrophages and neutrophils that senses medium-chain fatty acids and activates NF-kB/NLRP3; expressed in microglia with role in neuroinflammation"
"Grm4","GPCR","Group III metabotropic glutamate receptor; G(i)-coupled; inhibits adenylyl cyclase; presynaptic autoreceptor reducing glutamate release; modulates motor learning and cerebellar plasticity","L-glutamate","plasma membrane (presynaptic)","brain (cerebellum; striatum; spinal cord); retina","cerebellar granule cells; Purkinje cells; striatal neurons","metabotropic glutamate signaling; presynaptic inhibition; cAMP inhibition; motor learning","abnormal motor learning; decreased paired-pulse facilitation; decreased post-tetanic potentiation; increased prepulse inhibition","moderate","abnormal motor learning; impaired cerebellar synaptic plasticity","GRM4 expressed in cerebellum; KO shows abnormal motor learning and impaired cerebellar synaptic plasticity; expressed in cerebellar granule cells","breast cancer (GRM4 as CAR-T target); kidney clear cell carcinoma","novel BC membrane antigen for CAR-T therapy; expression in KIRC","major depressive disorder; SCI-associated immune changes","expressed in cerebellar granule cells; required for normal cerebellar synaptic plasticity and motor learning","Presynaptic inhibitory metabotropic glutamate receptor regulating motor learning and cerebellar synaptic plasticity; identified as novel breast cancer membrane antigen for CAR-T therapy"
"Kndc1","GTPase/regulator","Brain-specific RAS-GEF (guanine nucleotide exchange factor) with two KIND (kinase non-catalytic C-lobe) domains; activates RAS; negatively regulates dendrite growth via MAP2 signaling; promotes cellular senescence","RAS; MAP2","cytoplasm; dendrites; neuronal cell body","brain (cerebellum; hippocampus)","cerebellar granule cells; hippocampal neurons; endothelial cells","RAS-MAP2 signaling; dendrite growth inhibition; cellular senescence","enhanced coordination; abnormal cerebellar glomerulus morphology; abnormal cerebellar granule cell morphology; abnormal dendrite morphology; increased grip strength; abnormal excitatory synapse morphology","moderate","abnormal cerebellar granule cell morphology; abnormal dendrites; enhanced coordination","v-KIND is predominantly expressed in cerebellar granule cells; KO shows abnormal cerebellar glomerulus and granule cell morphology with altered dendrites","ovarian cancer","KNDC1 knockdown promotes ovarian cancer progression; acts as tumor suppressor","epileptic encephalopathy (candidate gene by brain expression)","v-KIND expressed predominantly in cerebellar granule cells; required for normal dendrite growth, synaptic morphology and cerebellar function","Brain-specific RAS-GEF expressed in cerebellar granule cells that negatively regulates dendrite growth and synaptic morphology; KO causes abnormal cerebellar granule cell development"
"Klhl21","ubiquitin ligase","Substrate adaptor of BCR (BTB-CUL3-RBX1) E3 ubiquitin-protein ligase; mediates ubiquitination of AURKB; required for CPC relocation from chromosomes to spindle midzone in anaphase; promotes cell migration via FA-MT interactions","AURKB (ubiquitination)","spindle midzone; focal adhesions; microtubule ends","ubiquitous (dividing cells); brain; liver","dividing cells; migrating cells; neural cells","CRL3-KLHL21 ubiquitin ligase complex; CPC midzone localization; cytokinesis; cell migration","preweaning lethality (incomplete penetrance)","severe",NA,"expressed in brain; associated with Alzheimer's disease ubiquitination gene signatures","hepatocellular carcinoma; breast cancer; gastric cancer","prognostic in HCC and breast cancer; regulated by crotonylation in HCC","Alzheimer's disease (ubiquitination pathway)","ubiquitinates AURKB to regulate mitotic exit; promotes cell migration via microtubule-focal adhesion crosstalk","BCR E3 ubiquitin ligase adaptor that ubiquitinates Aurora B to relocalize the chromosomal passenger complex in anaphase; required for efficient cytokinesis and cell migration"
"Myh7b","motor protein","Myosin II heavy chain motor; ATP-driven actin-based motor; muscle contraction; in non-muscle contexts expressed in specialized cells (liver; tongue; slow-twitch muscle; neurons); regulated by alternative splicing","actin (F-actin)","sarcomere; cytoplasm (non-muscle)","specialized muscle (tongue; slow-twitch); liver; heart (low); neurons (host miR-499)","slow-twitch muscle fibers; hepatocytes; certain non-muscle cells","actomyosin contractility; sarcomere assembly; miR-499 host gene (regulates muscle fiber type via SOX6 repression)","decreased circulating cholesterol; increased red blood cell distribution width","mild",NA,NA,NA,NA,"McArdle disease is distinct (Pygm); no direct cancer role described","promotes slow-twitch muscle fiber type specification via miR-499; regulated by methylation during myogenesis","Ancient sarcomeric myosin whose mammalian expression is restricted by alternative splicing; hosts miR-499 that regulates muscle fiber-type specification by repressing SOX6"
"Tnfsf13","secreted factor","TNF family cytokine (APRIL); binds TACI (TNFRSF13B) and BCMA (TNFRSF17); promotes B cell survival, maturation, and Ig class switching; regulates mucosal immunity","TNFRSF13B (TACI); TNFRSF17 (BCMA)","secreted; extracellular","immune tissues (spleen; lymph nodes; gut mucosa); widely expressed","B cells; monocytes/macrophages; T cells; intestinal epithelial cells","TNF-APRIL-TACI/BCMA signaling; B cell maturation; IgA production; mucosal immunity; NF-kB","decreased IgA/IgM; increased IgG1; abnormal class switch recombination; increased germinal centers; decreased susceptibility to induced arthritis","moderate",NA,NA,"non-small cell lung cancer; ovarian cancer; various","initially identified as overexpressed in cancers; prognostic in NSCLC; context-dependent tumor-promoting or suppressing","myasthenia gravis; neuromyelitis optica (NMOSD); anti-NMDAR encephalitis (immune context)","TNFSF13 in intestinal epithelial cells regulates mucosal healing; important in B cell differentiation","TNF family cytokine APRIL that drives B cell survival/class switching via TACI and BCMA; overexpressed in multiple cancers and implicated in autoimmune neurology"
"Btbd17","scaffold/adaptor","Substrate adaptor for CRL3 ubiquitin ligase complexes via BTB-POZ domain; facilitates ubiquitin-mediated protein degradation",NA,"cytoplasm; nucleus","ubiquitous",NA,"ubiquitin-proteasome pathway","abnormal epididymis morphology; enlarged epididymis","mild",NA,NA,NA,NA,NA,NA,"BTB/POZ domain protein likely functioning as a CRL3 ubiquitin ligase adaptor with limited characterized biology; no neural phenotype in KO."
"Sebox","transcription factor","Transcriptional regulation of mesoderm/endoderm specification and zygotic genome activation; paired-like homeodomain binds DNA","DNA regulatory elements","nucleus","brain; skin; ovary; liver","oocytes; embryonic cells; neurons","Nodal/Wnt signaling; zygotic genome activation","increased fasting circulating glucose level","mild","expressed in brain neurons",NA,NA,NA,NA,"maternal effect gene regulating early embryogenesis; expressed in oocytes and brain","Paired-like homeodomain transcription factor essential as a maternal effect gene for 2-cell stage zygotic genome activation; also expressed in brain and skin."
"Gstt3","enzyme","Glutathione conjugation of hydrophobic electrophiles and hydroperoxides; detoxification of xenobiotics","4-nitrobenzyl chloride; cumene hydroperoxide; CDNB; ethacrynic acid","cytoplasm","liver; kidney","hepatocytes","glutathione metabolism; xenobiotic detoxification; oxidative stress response",NA,NA,NA,NA,NA,NA,NA,NA,"Theta-class glutathione S-transferase catalyzing conjugation of reduced glutathione to electrophilic xenobiotics and endogenous substrates for detoxification."
"Susd2","receptor","Putative cytokine receptor for GPR15LG; tumor suppressor activity; G1 cell cycle arrest in colon cancer cells","GPR15LG","plasma membrane","endometrium; brain","mesenchymal stem cells; perivascular stromal cells; neurons","cell cycle regulation; complement/adhesion; stem cell maintenance",NA,NA,"expressed in neurons; CCP domain-containing protein with neuronal function","neuronal expression; CCP domain with neuronal function documented","breast cancer; colon cancer","tumor suppressor; growth inhibitory",NA,"marks endometrial perivascular mesenchymal stem cells; potential role in neural adhesion","Transmembrane protein with complement control protein (CCP/sushi) domain acting as stem cell marker in endometrium and putative tumor suppressor in colon cancer; also expressed in neurons."
"1700008O03Rik","other","Potential role in spermatogenesis regulation; expression in developing testis",NA,NA,"testis; brain","spermatogenic cells","spermatogenesis","abnormal hair growth; increased hematocrit","mild",NA,NA,NA,NA,NA,NA,"Poorly characterized RIKEN gene with testis-specific expression during development; implicated in spermatogenesis regulation by expression profiling."
"Chdh","enzyme","Oxidation of choline to betaine aldehyde (then to betaine); mitochondrial FAD-dependent oxidoreductase","choline","mitochondrial inner membrane","liver; kidney; testes; brain","hepatocytes; spermatocytes","choline metabolism; one-carbon metabolism; betaine biosynthesis; methyl donor pathway","reduced male fertility; asthenozoospermia; abnormal mitochondrial crista morphology; abnormal depression-related behavior; increased circulating homocysteine","moderate","abnormal depression-related behavior",NA,NA,NA,"spinocerebellar ataxia (expression profiling)",NA,"Mitochondrial choline dehydrogenase converting choline to betaine aldehyde; critical for sperm mitochondrial integrity, one-carbon metabolism, and methyl donor production; KO causes male infertility and depression-like behavior."
"Slc25a35","transporter","Mitochondrial antiporter exchanging dicarboxylates and sulfur oxoanions across inner mitochondrial membrane; transports phosphoenolpyruvate (PEP) to cytosol","dicarboxylates; sulfur oxoanions; phosphoenolpyruvate","mitochondrial inner membrane","ubiquitous; liver; heart",NA,"mitochondrial metabolism; PEP signaling; TCA cycle","increased heart weight","mild",NA,NA,"pancreatic ductal adenocarcinoma",NA,NA,NA,"Mitochondrial carrier protein of the SLC25 family transporting dicarboxylates and phosphoenolpyruvate across the inner mitochondrial membrane to support cytosolic metabolic needs."
"Tbata","scaffold/adaptor","Modulates stromal cell proliferation by interfering with the NEDD8 neddylation pathway; expressed in polarized cells (neurons, TEC, germ cells)","NEDD8 pathway components","cytoplasm; nucleus","thymus; brain; testes","thymic epithelial cells; neurons; spermatids","NEDD8/neddylation pathway; cell cycle regulation","thymus hyperplasia; enlarged thymus; increased thymocyte number; abnormal cerebellum external granule cell layer morphology; increased double-negative T cell number; abnormal thymus epithelium morphology","moderate","abnormal cerebellum external granule cell layer morphology","KO shows abnormal cerebellar external granule cell layer morphology; expressed in brain neurons; Down syndrome mouse model shows altered expression",NA,NA,NA,"spermatid differentiation","Thymus/brain/testes-associated protein expressed in highly polarized cells (neurons, TEC, spermatids) that regulates thymic epithelial cell proliferation via the NEDD8 pathway; KO mice show cerebellar granule cell layer defects."
"Ankrd33b","scaffold/adaptor","Ankyrin repeat domain scaffold protein; potential chromatin or signaling interactions",NA,"nucleus","lung; placenta; brain","fetal lung cells",NA,NA,NA,NA,NA,NA,NA,NA,NA,"Poorly characterized ankyrin repeat domain protein; identified in screens for DNA methylation changes in fetal lung and viral infection; no functional studies available."
"Sidt1","transporter","Binds and imports long dsRNA (>300 bp) into cells; required for cell-surface RNA presentation and neutrophil recruitment; mediates antiviral IFN-I responses","long dsRNA (>300 bp)","plasma membrane; ER; lysosomes","lymphoid tissues; liver; lung","plasmacytoid dendritic cells; lymphocytes; neutrophils","dsRNA sensing; innate immune signaling; type I interferon response; RNAi systemic spread","abnormal liver morphology; abnormal lymph node morphology","mild",NA,NA,"non-small cell lung cancer","tumor suppressor (downregulated in NSCLC)",NA,NA,"Mammalian homolog of C. elegans SID-1 that binds long dsRNA and mediates cell-surface RNA transport; required for antiviral type I interferon responses and neutrophil recruitment via glycoRNA display."
"Aifm3","enzyme","Pro-apoptotic flavoprotein inducing caspase-dependent apoptosis; reduces mitochondrial membrane potential",NA,"mitochondria","ubiquitous; liver; brain","hepatocytes; neurons; cholinergic neurons","apoptosis; mitochondrial cell death pathway","abnormal circulating LDL cholesterol; abnormal cholesterol homeostasis; increased fasting circulating glucose","mild","expressed in cholinergic neurons of medial septum; identified in neurodegeneration datasets",NA,"colorectal cancer; bladder cancer","tumor suppressor; pro-apoptotic","22q11.2 deletion syndrome",NA,"Mitochondria-associated apoptosis-inducing factor family member that triggers caspase-dependent apoptosis and reduces mitochondrial membrane potential; expressed in medial septum cholinergic neurons."
"Asrgl1","enzyme","L-asparaginase and beta-aspartyl peptidase activity; hydrolysis of L-asparagine to L-aspartate and ammonia; may generate excitatory neurotransmitter L-aspartate in brain","L-asparagine; beta-aspartyl dipeptides; aspartame","cytoplasm","brain; retina; ubiquitous","retinal photoreceptors; neurons","amino acid metabolism; neurotransmitter production","abnormal retina photoreceptor layer morphology; retina cone and rod cell degeneration; decreased a-wave and b-wave amplitude; photoreceptor degeneration","severe","retinal neurodegeneration; photoreceptor degeneration","KO shows severe retinal photoreceptor degeneration (rod and cone)","nasopharyngeal carcinoma; endometrial cancer","tumor suppressor (downregulated in multiple cancers)","retinal dystrophy","may generate L-aspartate neurotransmitter in retinal neurons","Intracellular L-asparaginase/beta-aspartyl peptidase that may produce L-aspartate as excitatory neurotransmitter; KO causes severe progressive retinal photoreceptor degeneration with functional loss."
"Afap1l2","scaffold/adaptor","Enhances SRC kinase activity; links SRC to actin cytoskeleton and transcription activation; scaffolds signaling complexes at apical membranes","SRC kinase","cytoplasm; plasma membrane; acical membrane","thyroid; lung; liver; brain","thyroid epithelial cells; oligodendrocyte precursors; immune cells","SRC signaling; actin cytoskeleton organization; PTPRZ signaling in OPC differentiation","abnormal coat/hair; decreased locomotor activity; increased startle reflex; abnormal auditory brainstem response; decreased total body fat","moderate","abnormal auditory brainstem response; decreased locomotor activity; increased startle reflex","involved in PTPRZ/pleiotrophin-regulated OPC differentiation","hepatocellular carcinoma; prostate cancer","oncogenic (XB130 form promotes tumor growth)",NA,"OPC differentiation (PTPRZ substrate)","Actin filament-associated adaptor protein (XB130/AFAP1L2) that enhances SRC kinase activity; KO mice show auditory and locomotor defects; implicated in oligodendrocyte precursor differentiation downstream of PTPRZ."
"Paqr8","GPCR","Membrane progesterone receptor coupled to Gi proteins; mediates non-genomic progesterone signaling; may regulate oocyte maturation","progesterone; DHEA; pregnanolone; pregnenolone; allopregnanolone","plasma membrane","ovary; brain; Schwann cells","oocytes; Schwann cells; neurons","progesterone non-genomic signaling; G(i) pathway; cAMP reduction","abnormal epididymis morphology; enlarged epididymis","mild","expressed in Schwann cells and brain neurons",NA,NA,NA,NA,"Schwann cell myelination (progesterone signaling)","Plasma membrane progesterone receptor of the PAQR family mediating non-genomic Gi-coupled progesterone signaling; expressed in Schwann cells where progesterone promotes myelination."
"Ogfrl1","receptor","Opioid growth factor receptor-like protein; loss-of-function associated with chronic recurrent multifocal osteomyelitis (CRMO); putative immune regulatory receptor",NA,"plasma membrane","bone; immune cells; brain; testis","macrophages; osteoclasts; spermatogonia; cortical subplate neurons","opioid/growth factor signaling; bone homeostasis; innate immunity","no abnormal phenotype detected; abnormal coat/hair morphology","mild","expressed in cortical subplate neurons; expressed in spinal cord","expressed in subplate neurons",NA,NA,"chronic recurrent multifocal osteomyelitis","expressed in spermatogonial stem cell niche and subplate neurons","Opioid growth factor receptor-like protein expressed in subplate neurons, spermatogonia, and immune cells; loss-of-function variants linked to chronic recurrent multifocal osteomyelitis through immune dysregulation."
"Sphkap","scaffold/adaptor","A-kinase anchoring protein (AKAP) that anchors PKA type I regulatory subunit to subcellular compartments; links cAMP and sphingosine signaling via SPHK1 interaction","PKA regulatory subunit type I (PRKAR1); SPHK1","ER-PM junctions; cytoplasm","brain; pancreas; ubiquitous","neurons; pancreatic beta cells","cAMP/PKA signaling; sphingosine-1-phosphate signaling; ER-PM junction signaling","increased/decreased circulating insulin; abnormal insulin secretion; decreased circulating glucose","moderate","expressed in brain; linked to anencephaly and glioma","expressed in brain; anencephaly association","glioma","expression correlates with prognosis",NA,"PKA compartmentalization in neurons; beta cell insulin secretion","AKAP scaffold protein tethering PKA type I to ER-plasma membrane junctions and linking cAMP signaling to sphingosine pathways; regulates pancreatic beta cell insulin secretion and expressed in brain neurons."
"Tmem141","other","Transmembrane protein of unknown function; associated with neurodevelopmental disorders in human genetics",NA,"membrane","brain; ubiquitous",NA,NA,NA,NA,"intellectual disability; spastic paraplegia",NA,NA,NA,"neurodevelopmental disorder (ID; spastic paraplegia)",NA,"Uncharacterized transmembrane protein identified in a consanguineous family with severe intellectual disability and spastic paraplegia; biological function unknown."
"Usp50","protease","Deubiquitinating enzyme; removes Lys-63-linked polyubiquitin from PYCARD/ASC (inflammasome), Lys-48 ubiquitin from ACE2, prevents WEE1 degradation to block G2/M entry; promotes DNA replication","PYCARD/ASC; ACE2; WEE1; RPS10/eS10; NLRP3","nucleus; chromatin; cytoplasm","ubiquitous; liver; lung","macrophages; hepatocytes; cancer cells","inflammasome signaling; G2/M checkpoint; DNA replication; ubiquitin-proteasome pathway","preweaning lethality (complete penetrance); irregularly shaped pupil; decreased prepulse inhibition","severe","decreased prepulse inhibition (sensorimotor gating)","KO shows decreased prepulse inhibition and irregular pupil","hepatocellular carcinoma; gastric cancer","tumor suppressor; regulates NLRP3 and inflammasome",NA,NA,"Deubiquitinating enzyme with broad substrate specificity including inflammasome adaptor ASC, cell cycle regulator WEE1, and replication fork maintenance; complete KO causes perinatal lethality."
"Vamp1","structural protein","v-SNARE protein mediating vesicle fusion with target membranes; component of SNARE complex for synaptic vesicle exocytosis and neurotransmitter release","syntaxin; SNAP-25; NSF","synaptic vesicle membrane","neurons; muscle; oocytes","motor neurons; GABAergic neurons; skeletal muscle cells","SNARE-mediated membrane fusion; synaptic vesicle exocytosis; neurotransmitter release","decreased body size; abnormal posture; postnatal lethality (complete penetrance); impaired limb coordination; impaired righting response; akinesia","lethal","motor defects; impaired limb coordination; akinesia; complete postnatal lethality","expressed in cerebellum; SNARE expression in cerebellum correlates with neurotransmitter pathways",NA,NA,"congenital myasthenic syndrome-25 (CMS-25); Alzheimer's disease (synaptic dysfunction)","expressed at motor neuron terminals and GABAergic synapses; regulates neurotransmitter release","Vesicle-associated membrane protein 1 (synaptobrevin) essential v-SNARE for synaptic vesicle exocytosis at motor neuron terminals; human mutations cause congenital myasthenic syndrome-25; KO mice die postnatally with severe motor deficits."
"Magix","scaffold/adaptor","MAGI family scaffolding protein; contains multiple PDZ domains for scaffolding signaling complexes; X-linked",NA,"plasma membrane; postsynaptic density","ubiquitous; brain","neurons; epithelial cells","scaffold/PDZ domain signaling; cell junction organization","decreased leukocyte cell number; increased mean platelet volume; decreased hemoglobin; decreased erythrocyte number; increased circulating creatinine","moderate",NA,NA,"lung adenocarcinoma (identified in circRNA analysis)",NA,NA,NA,"MAGI family PDZ-domain scaffold protein; X-linked; KO shows hematologic abnormalities; poorly characterized with limited functional studies in neural context."
"Loxhd1","structural protein","Required for hair cell stereocilia function and mechanotransduction; composed entirely of PLAT (polycystin/lipoxygenase/alpha-toxin) domains; localizes to tip links of stereocilia","tip link complex components","stereocilia; hair cell apical surface","inner ear","cochlear hair cells (inner and outer)","mechanotransduction; stereocilia tip link organization; hair cell function","decreased startle reflex; cochlear hair cell degeneration; absent otoacoustic emissions; deafness; cochlear ganglion degeneration","severe","deafness; cochlear ganglion degeneration",NA,"prostate cancer (antigen identified in TCR screen)",NA,"DFNB77 autosomal recessive hearing loss; late-onset hearing loss (heterozygous)","required for mature hair cell function","Stereocilia-associated protein composed exclusively of PLAT domains required for cochlear hair cell mechanotransduction; loss-of-function causes DFNB77 nonsyndromic sensorineural hearing loss in humans."
"Akr1c14","enzyme","Aldo-keto reductase reducing steroid ketones; synthesizes allopregnanolone (ALLO) in placenta; GABA-A receptor modulator precursor","steroid substrates; ketosteroids; placental progesterone metabolites","cytoplasm; endoplasmic reticulum","placenta; brain; liver; testes","trophoblast cells; Leydig cells; neurons","steroid hormone metabolism; neurosteroid synthesis; GABA-A receptor modulation; allopregnanolone pathway","abnormal social/conspecific interaction; decreased anxiety; increased stereotypic behavior; decreased oligodendrocyte number; hypermyelination/dysmyelination; decreased vocalization","severe","abnormal social behavior; dysmyelination; decreased vocalization; autism-like features in placenta-specific KO","placenta-specific KO shows sex-divergent cerebellar hypoplasia/injury",NA,NA,"autism spectrum disorder (placental neurosteroid pathway)","placental neurosteroid synthesis regulates cerebellar neurodevelopment in sex-specific manner","Placental aldo-keto reductase synthesizing allopregnanolone (ALLO), a neurosteroid GABA-A receptor modulator; placenta-specific KO causes sex-divergent cerebellar hypoplasia and autism-like behaviors."
"Ly6d","receptor","GPI-anchored lymphocyte antigen; cell-surface specification marker for earliest B-cell commitment; distinguishes B vs T lineage fate in lymphoid progenitors",NA,"GPI-anchored plasma membrane","bone marrow; lymphoid tissues; prostate","B-cell progenitors; lymphoid progenitors; pDC precursors; castrate-resistant prostate cells","lymphocyte lineage specification; hematopoiesis; B-cell development","increased vertical activity","mild",NA,NA,"prostate cancer","marker of castrate-resistant prostate cancer luminal cells",NA,"marks earliest B-cell specification from common lymphoid progenitors","GPI-anchored lymphocyte antigen 6 family protein marking the earliest committed B-cell progenitors in bone marrow; also marks castrate-resistant luminal cells in prostate cancer."
