"gene","protein_class","molecular_action","key_substrates","subcellular","tissues","cell_types","pathways","ko_phenotype","ko_severity","neural_phenotype","cerebellar_evidence","cancer_types","cancer_role","neuro_disease","differentiation_role","one_line_summary"
"Abca8b","transporter","ATP-binding cassette lipid transporter; mediates cholesterol and taurocholate efflux; enhances ABCA1-mediated cholesterol efflux to apoA-I; promotes sphingomyelin synthesis in oligodendrocytes","cholesterol; taurocholate; sphingomyelin; apoA-I; HDL","plasma membrane; intracellular membranes","brain (oligodendrocytes); liver","oligodendrocytes; hepatocytes","cholesterol/sphingomyelin homeostasis; myelin lipid metabolism; HDL biogenesis","decreased circulating HDL/LDL/triglycerides/cholesterol","mild","NA; associated with multiple system atrophy (MSA) and ALS in functional studies","highly expressed in oligodendrocytes; ABCA8 critical for sphingomyelin synthesis in myelin; implicated in MSA via alpha-synuclein pathology","lung adenocarcinoma (LINC00982 axis); HNOSCC (expression screen)",NA,"multiple system atrophy (lipid/myelin dysfunction); ALS (sphingomyelin dysregulation)","expressed in oligodendrocytes during myelination; regulates lipid composition during myelin differentiation","Oligodendrocyte lipid transporter (ABCA8/ABCA8b) that promotes sphingomyelin synthesis for myelination; deficiency linked to multiple system atrophy."
"Grin2c","ion channel","NMDA receptor GluN2C subunit; low Mg2+ sensitivity; no desensitization; binds glutamate; required for NMDA receptor activation; co-agonists glutamate+glycine+depolarization","L-glutamate; glycine; D-serine; Mg2+; Na+; K+; Ca2+","postsynaptic membrane","cerebellum (granule cell layer); thalamus","cerebellar granule cells; thalamic neurons","NMDA receptor-mediated Ca2+ entry; synaptic plasticity; LTP; cerebellar granule cell physiology; GluN2B-to-GluN2A subunit switching context","thin cerebellar molecular/granule layers; impaired coordination; abnormal NMDA-mediated synaptic currents","mild-moderate","impaired coordination; thin cerebellar layers; abnormal NMDA currents","expressed specifically in cerebellar granule cells; KO shows cerebellar layer thinning and impaired coordination; expressed downstream of Kdm6b (H3K27me3 demethylase) in GNPs","glioma (sex-stratified screen)",NA,"alcohol dependence (genetic association); cerebellar atrophy (functional screen)","expressed during late GNP differentiation; GRIN2C expression is induced by Kdm6b demethylation in GNPs; marks mature granule cell identity","GluN2C NMDA receptor subunit expressed specifically in cerebellar granule cells; required for normal cerebellar layer formation and synaptic function."
"Atp2a3","enzyme","SERCA3 pump; Mg2+-dependent Ca2+-ATPase; transports Ca2+ from cytosol into ER/SR lumen; regulates cytosolic Ca2+ concentration","Ca2+; Mg2+; ATP","ER/SR membrane","ubiquitous (broad); gastrointestinal; hematopoietic; skeletal muscle; vascular endothelium","endothelial cells; smooth muscle cells; non-muscle cells; neurons","Ca2+ homeostasis; ER Ca2+ re-sequestration; cell growth/differentiation; apoptosis regulation","abnormal vascular endothelial physiology; abnormal muscle relaxation","mild","NA; associated with spinocerebellar ataxia 2 (expression screen)","expressed in brain; associated with SCA2/ATXN2 pathway in cerebellar context (expression screen)","gastric cancer; colon cancer; breast cancer; thyroid cancer (functional: downregulated; SERCA3 loss promotes tumor progression)","tumor suppressor via differentiation-promoting Ca2+ signaling; downregulated in multiple cancers","Parkinson's disease; bipolar disorder; SCA2 (screen)","SERCA3 expression increases during in vitro cell differentiation; promotes differentiation by modulating Ca2+ homeostasis","SERCA3 Ca2+-ATPase that sequesters Ca2+ into ER; downregulated in cancer; promotes differentiation via Ca2+ signaling."
"Slc13a5","transporter","electrogenic Na+-citrate cotransporter (NaCT/mINDY); imports citrate from blood into cells (liver neurons); 4 Na+ per citrate; trivalent citrate preferred","citrate; Na+; succinate (low affinity)","plasma membrane","liver; brain (neurons); testis; kidney","hepatocytes; neurons; liver sinusoidal cells","citrate transport into cell; TCA cycle; lipogenesis; cholesterol synthesis; glycolysis; gluconeogenesis; mTOR signaling (citrate-acetyl-CoA axis)","decreased body weight; improved glucose tolerance; protection from diet-induced obesity; decreased circulating insulin; abnormal liver/muscle physiology","mild (metabolically beneficial)","epileptic encephalopathy; developmental delay (human biallelic mutations)","highly expressed in neurons; human mutations cause neonatal epileptic encephalopathy; developmental regulation in human brain defined","hepatocellular carcinoma (functional: SLC13A5 inhibition suppresses HCC)","suppressor context: inhibition reduces HCC growth","neonatal epileptic encephalopathy (SLC13A5 epilepsy); metabolic brain dysfunction","expressed in developing neurons; SLC13A5 regulates citrate-dependent metabolic pathways during neuronal differentiation","Neuronal/hepatic Na+-citrate transporter (NaCT); biallelic mutations cause neonatal epileptic encephalopathy; hepatic inhibition protects from metabolic disease."
"Cacna1g","ion channel","voltage-gated T-type calcium channel (Cav3.1/alpha-1G); low-voltage-activated; generates burst firing; pacemaker activity in thalamus and cerebellum; involved in sleep oscillations and motor coordination","Ca2+","plasma membrane","brain (cerebellum; thalamus; cortex); heart (sinoatrial/AV node); endocrine","thalamic neurons; cerebellar neurons (Purkinje/granule); sinoatrial node cells","low-threshold Ca2+ signaling; burst firing; sleep oscillations (thalamo-cortical); motor coordination; cardiac pacemaking; T-type Ca2+ current (IT)","decreased seizure susceptibility; abnormal spike-wave discharge; fragmented sleep; decreased heart rate; prolonged PQ interval; abnormal sinoatrial conduction; decreased locomotor activity","moderate","abnormal spike-wave discharge; fragmented sleep; decreased locomotor activity; impaired firing","de novo gain-of-function mutations cause severe cerebellar disorder (SCA42ND) with neurodevelopmental deficits; expressed in cerebellum","NA (tumor microenvironment screens)",NA,"spinocerebellar ataxia 42 (SCA42/SCA42ND; de novo GOF); childhood cerebellar atrophy; absence epilepsy (LOF)","expressed in developing cerebellum; SCA42ND variants functionally validated as gain-of-function causing developmental cerebellar disorder","Cav3.1 T-type calcium channel essential for cerebellar development; de novo gain-of-function mutations cause SCA42 with severe cerebellar disorder."
"Ryr2","ion channel","cardiac ryanodine receptor/Ca2+ release channel; Ca2+-induced Ca2+ release (CICR) from SR; triggered by L-type Ca2+ channel (CACNA1C); regulates cardiac contractility; also expressed in brain neurons","Ca2+; ryanodine; caffeine; FK506-binding proteins (FKBP12.6)","SR/ER membrane","heart; brain (cerebellum; hippocampus; basal ganglia)","cardiomyocytes; neurons","CICR; E-C coupling; cardiac rhythm; IP3R signaling (cross-talk); Ca2+ homeostasis; RyR-IP3R interaction in beta cells","embryonic lethality during organogenesis; abnormal myocardial trabeculae; irregular heartbeat; ventricular fibrillation; disorganized myocardium","severe; lethal","expressed in cerebellum and brain; role in neuronal Ca2+ signaling","highly expressed in cerebellum; RyR2 mediates neuronal Ca2+ release important for Purkinje cell signaling","NA (expression screens in various cancers including food allergy methylome)",NA,"catecholaminergic polymorphic ventricular tachycardia (CPVT); arrhythmogenic cardiomyopathy; heart failure; autism (brain expression screen)","expressed in cardiomyocytes during cardiac differentiation; required for heart development; also expressed in neurons during differentiation","Cardiac ryanodine receptor mediating Ca2+-induced Ca2+ release; embryonic KO lethal; mutations cause ventricular arrhythmia and cardiomyopathy."
"Cacna2d3","channel regulator","auxiliary alpha-2/delta-3 subunit of voltage-gated Ca2+ channels; regulates calcium current density and activation/inactivation kinetics of P/Q, N, and L-type channels; implicated in pain signaling","Ca2+ channel alpha subunits (Cav2.1, Cav2.2, Cav1.2, Cav1.3)","plasma membrane; ER (synthesized as single precursor, cleaved to alpha2 and delta, disulfide-linked)","brain; dorsal root ganglia; heart; peripheral nervous system","neurons; nociceptors; sensory neurons","Ca2+ channel modulation; nociception; pain signaling; neurotransmitter release; autism-related synaptic function","hyperactivity; decreased startle reflex; increased aggression; increased thermal pain threshold; impaired autophagy; abnormal macrophage physiology","mild-moderate","abnormal nociception; hyperactivity; increased aggression; altered pain threshold; impaired autophagy in neurons","expressed in brain; linked to autism (functional screen); implicated in pain-related neuronal function","gastric cancer (epigenetic silencing); atrial fibrillation (screen)","epigenetically silenced in gastric cancer (potential suppressor)","autism spectrum disorder (functional studies); chronic pain; subarachnoid hemorrhage (screen)","expressed in developing neurons; implicated in autism-related early developmental steps (screen)","Auxiliary Ca2+ channel subunit (alpha-2/delta-3) modulating pain signaling and synaptic Ca2+ currents; linked to autism and nociception."
"Slc7a8","transporter","large neutral amino acid antiporter (LAT2); heterodimer with SLC3A2/4F2hc; bidirectional exchange of neutral and essential amino acids; thyroid hormone transport; methylmercury uptake","large neutral amino acids (Leu, Ile, Val, Phe, Tyr, Trp, His); thyroid hormones (T3, T4); Na+-independent","plasma membrane (basolateral)","kidney; intestine; brain; cochlea; liver","renal tubular cells; enterocytes; neurons; cochlear cells; immune cells (Th2)","amino acid homeostasis; essential amino acid recycling; thyroid hormone transport; Th2 immune differentiation; cochlear function","decreased locomotor activity; impaired coordination; cochlear degeneration; hearing loss; decreased circulating fructosamine","moderate","impaired coordination; cochlear degeneration; hearing loss","expressed in brain; supports neuronal amino acid homeostasis; cochlear expression required for hearing","uveal melanoma (super-enhancer analysis); gastric cancer (young adults); HNSCC (scRNA-seq)",NA,"hearing loss (cochlear degeneration); Th2-mediated immune diseases","expressed in absorptive epithelia; regulates amino acid availability during cellular differentiation; Th2-specific differentiation role","Basolateral neutral amino acid antiporter (LAT2) required for cochlear function; KO causes hearing loss and impaired coordination."
"Jph4","structural protein","junctophilin-4; bridges plasma membrane and ER at junctional membrane complexes (JMCs); recruits and slows inactivation of Cav2.1; scaffolds SOCE complex in sensory neurons; facilitates ER Ca2+ store refill","Cav2.1 (P/Q-type Ca2+ channel); STIM proteins; plasma membrane lipids; ER membrane","plasma membrane-ER junctional complex","brain (neurons); dorsal root ganglia (sensory neurons); hippocampus","neurons (motor coordination; memory circuits); sensory neurons; CA1 pyramidal cells","Ca2+ store-operated entry (SOCE); ER-PM junctions; Cav2.1 modulation; Ca2+ signaling; hippocampal sAHP; T cell activation","abnormal T cell activation; abnormal Ca2+ homeostasis; abnormal interleukin levels","mild","NA in CNS KO; sensory neuron knockdown impairs SOCE and nociception","brain-specific expression; required for motor coordination and memory circuits; involved in CA1 pyramidal cell sAHP; JPH4 forms ER-PM junctions critical for neuronal Ca2+ signaling","prostate cancer (expression screen); kidney renal clear cell carcinoma (screen)",NA,"NA; implicated in sensory neuron pain signaling","expressed in developing neurons; JPH4 organizes ER-PM junctions enabling Ca2+ signaling during neuronal maturation","Brain-specific junctophilin-4 scaffolding ER-PM junctions; required for neuronal SOCE and Cav2.1 modulation; important for motor coordination and memory."
"Cacna1i","ion channel","voltage-gated T-type calcium channel (Cav3.3/alpha-1I); low-voltage-activated; generates low-threshold Ca2+ spikes; modulates neuronal burst firing and network oscillations; VEGF-regulated","Ca2+","plasma membrane","brain; liver; spleen; pancreas; heart","neurons; thalamic neurons; neocortical neurons","low-threshold Ca2+ entry; thalamic oscillations; neuronal excitability; sleep regulation; nociception","decreased locomotor activity; abnormal action potentials; abnormal afterhyperpolarization; abnormal brain wave pattern; small liver and heart; abnormal pancreas","moderate","abnormal action potentials; altered brain wave pattern; decreased locomotor activity; abnormal afterhyperpolarization","expressed in brain; Cav3.3 contributes to neuronal oscillations; linked to neurodevelopmental disorders","breast cancer (EMT/invasion screen); uveal melanoma (OXPHOS screen)",NA,"intellectual disability; epilepsy; cerebellar ataxia (screen); Dandy-Walker variant (rare case association)","expressed in neurons; VEGF regulates Cav3.3 activity during neuronal plasticity","Cav3.3 T-type calcium channel generating low-threshold Ca2+ spikes in neurons; modulates thalamic oscillations and neuronal excitability."
"Faim2","other","anti-apoptotic protein; inhibits Fas/caspase-8-mediated apoptosis in neurons; regulates cerebellar development (IGL thickness; Purkinje cell development); possibly interacts with XIAP","Fas receptor pathway; caspase-8","cytoplasm; plasma membrane","brain (cerebellum); neurons","cerebellar neurons; Purkinje cells; granule cells","Fas-mediated apoptosis; caspase-8 signaling; cerebellar development; neuroprotection; neuronal survival","increased seizure susceptibility; increased cerebral infarct size; hydronephrosis; small spleen; cataract","moderate","increased seizure susceptibility; increased cerebral infarct size","expressed in cerebellum; required for normal IGL thickness and Purkinje cell development; directly implicated in cerebellar granule cell survival","medulloblastoma (differentially expressed between metastatic and non-metastatic; functional studies)","expressed in MB; associated with metastatic MB; potential oncogenic role","obesity (GWAS locus); type 2 diabetes (screen)","expressed in cerebellar granule cells; protects against apoptosis during IGL formation; critical for GNP survival during differentiation","Neuroprotective anti-apoptotic protein that inhibits Fas/caspase-8; required for cerebellar granule layer development and linked to medulloblastoma metastasis."
"Scn8a","ion channel","pore-forming alpha subunit of Nav1.6 voltage-gated sodium channel; generates persistent and resurgent Na+ currents; regulates action potential threshold and propagation; highly expressed at nodes of Ranvier and AIS","Na+","plasma membrane (nodes of Ranvier; AIS; soma; dendrites)","brain (neurons; glia); spinal cord; peripheral nervous system; muscle","neurons (cortical; cerebellar; Purkinje cells; granule cells); glia; macrophages (isoform 5)","Na+-dependent action potential; neuronal excitability; resurgent Na+ current; podosome formation (macrophage isoform)","postnatal lethality; hindlimb paralysis; muscular atrophy; demyelination; decreased cerebellar granule cell number; hydrocephaly","severe; lethal","postnatal lethality; decreased cerebellar granule cell number; demyelination; paraparesis; abnormal nerve conduction","complete null: lethal with decreased cerebellar granule cell number; Purkinje cell-specific KO survives; cerebellar expression essential","NA (pan-cancer expression screens)",NA,"developmental and epileptic encephalopathy 13 (DEE13); benign familial infantile seizures 5; cognitive impairment; cerebellar ataxia","expressed in cerebellar granule cells; KO reduces granule cell number; Nav1.6 gain-of-function mutations cause epileptic encephalopathy","Nav1.6 sodium channel highly expressed in neurons; gain-of-function mutations cause epileptic encephalopathy; KO is lethal and reduces cerebellar granule cell number."
"Tmprss3","protease","type II transmembrane serine protease; activates ENaC (in vitro); required for cochlear hair cell survival at onset of hearing; activates saccular hair cell survival; probable permissive factor for spiral ganglion neuron survival","ENaC (epithelial Na+ channel; in vitro substrate); unknown cochlear substrates","plasma membrane (type II transmembrane)","cochlea (hair cells; spiral ganglion); inner ear (saccule)","cochlear inner and outer hair cells; vestibular hair cells; spiral ganglion neurons","cochlear hair cell survival; onset of hearing (P12-14); vestibular function; ENaC activation","deafness; cochlear hair cell degeneration; cochlear ganglion degeneration; absent cochlear inner/outer hair cells; vestibular hair cell degeneration; impaired coordination/swimming","severe (hearing)","impaired coordination and swimming (vestibular)","NA in brain per se; spiral ganglion neurons degenerate; cochlear nerve function impaired","breast cancer (prognostic expression screen); pancreatic cancer (differential expression screen)",NA,"autosomal recessive non-syndromic hearing loss (DFNB8/10); age-related hearing loss","expressed in cochlear hair cells; required for their survival at onset of hearing; cochlear differentiation context","TMPRSS3 serine protease essential for cochlear hair cell survival at hearing onset; mutations are a common cause of autosomal recessive deafness."
"Atp6v0c","enzyme","c-subunit (proteolipid) of V0 rotor of vacuolar H+-ATPase (V-ATPase); proton-conducting pore; mediates proton translocation across membranes; required for vesicular acidification; bafilomycin A1 binding subunit","H+; ATP (hydrolysis by V1 complex drives proton translocation)","lysosomal membrane; endosomal membrane; plasma membrane (in acidifying cell types)","ubiquitous; lysosomes; neuron; eye; testis","neurons; all cell types; lysosomal compartments","lysosomal acidification; autophagy-lysosome pathway; vesicular trafficking; Wnt/Notch signaling (endosomal pH); synaptic vesicle cycling; neurotransmitter loading","embryonic lethality before implantation (complete); failure of zygotic cell division","severe; lethal (homozygous)","associated with febrile seizures (human variants); neurodegeneration via autophagy failure","expressed in neurons; essential for autophagy-lysosome pathway; neuronal ATP6V0C role validated in SH-SY5Y cells; copy-number gain at 16p13.3 causes progressive ataxia and cognitive decline","NA (expression screens)",NA,"febrile seizures; early-onset progressive ataxia (16p13.3 gain); neurodegenerative disease (autophagy failure)","essential for lysosomal acidification required for autophagy during neuronal differentiation","Essential V-ATPase proton pore subunit required for lysosomal acidification; homozygous KO is pre-implantation lethal; neuronal function required for autophagy and synaptic vesicle cycling."
"Atp6v1g2","enzyme","G2 subunit of V1 peripheral complex of vacuolar H+-ATPase (V-ATPase); part of the stator stalk connecting V1 to V0; required for ATP hydrolysis-coupled proton translocation","H+; ATP","lysosomal membrane; synaptic vesicle membrane","brain (enriched); ubiquitous","neurons; synaptic terminals; lysosomes","lysosomal/endosomal acidification; synaptic vesicle cycling; autophagy; neurotransmitter loading","hyperactivity","mild","NA direct; hyperactivity in KO","expressed in neurons; important for synaptic vesicle cycling; implicated in Alzheimer's disease via SVC pathway","NA (cancer expression screens)",NA,"Alzheimer's disease (synaptic vesicle cycling screen); febrile seizures (related V-ATPase subunit screen)","expressed in neurons; V-ATPase required for neurotransmitter loading during synaptogenesis","V-ATPase V1 subunit contributing to lysosomal acidification and synaptic vesicle proton gradient; KO causes hyperactivity."
"Slc12a2","transporter","NKCC1; Na-K-2Cl cotransporter; electroneutral; mediates Cl- accumulation in immature neurons; drives excitatory GABA signaling in immature neurons; regulates cell volume; epithelial secretion","Na+; K+; Cl- (2 Cl- per Na+ and K+; electroneutral)","plasma membrane (basolateral in epithelia)","brain (ubiquitous early); inner ear; salivary glands; epithelia","immature neurons; cochlear and vestibular epithelium; choroid plexus; salivary epithelium","GABA excitatory phase in immature neurons; Cl- loading; cell volume regulation; inner ear endolymph; epithelial ion transport","deafness; circling; head bobbing; absent cochlear hair cells; collapsed Reissner membrane; hyperactivity; impaired motor coordination","moderate-severe","abnormal motor coordination; deafness (vestibular/cochlear); hyperactivity","expressed in immature neurons including cerebellar GNPs; drives excitatory GABA signaling before Slc12a5 (KCC2) takes over; downregulated during maturation","glioblastoma (expression study); hepatocellular carcinoma (lncRNA/exosome screen)","altered in GBM","bipolar disorder (GABAergic excitatory-to-inhibitory switch); epilepsy (immature GABA signaling)","expressed in immature neurons and downregulated during maturation; NKCC1 maintains excitatory GABA in developing neurons including GNPs before KCC2-mediated switch","NKCC1 Cl- loader maintaining excitatory GABA in immature neurons; downregulated during neuronal maturation as KCC2 takes over; KO causes deafness."
"Cabp2","channel regulator","calcium-binding protein 2; inhibits inactivation of Cav1.3 (L-type Ca2+ channel) in inner hair cell ribbon synapses; cooperates with CaBP1; required for sustained Ca2+ influx and indefatigable sound encoding; retinal signal transmission","Cav1.3 (CACNA1D); Cav1.2; calmodulin-binding sites","cytoplasm; IHC presynaptic terminal","cochlea (inner hair cells); retina","cochlear inner hair cells; retinal photoreceptors/bipolar cells","Ca2+ channel inactivation inhibition; inner hair cell ribbon synapse; sound encoding; retinal light signal transmission","abnormal IHC physiology; elevated ABR threshold; abnormal eye electrophysiology; decreased startle reflex; abnormal hair pigmentation","moderate","NA (cochlear/auditory; no CNS reported)","cochlear inner hair cells - not cerebellar",NA,NA,"autosomal recessive non-syndromic hearing loss DFNB93","expressed in IHCs where it supports Ca2+ signaling; IHC differentiation requires CaBP2 for proper Cav1.3 function","CaBP2 inhibits Cav1.3 inactivation in inner hair cells enabling indefatigable sound encoding; mutations cause autosomal recessive hearing loss (DFNB93)."
"Cnnm1","transporter","probable Mg2+/metal transporter (cyclin M1); copper storage protein in neuronal cells; member of CNNM family of metal transporters","Mg2+; Cu2+","plasma membrane; ER membrane","brain (neurons; oligodendrocytes); testis","neurons; oligodendrocytes; Sertoli cells; germ cells","Mg2+ homeostasis; copper storage in neurons; stem cell pluripotency (LIF/STAT3 pathway context); spermatogenesis","NA (no KO phenotype published in this dataset)",NA,"associated with progressive ataxia and cognitive decline (copy-number context with neighboring genes)","expressed in brain; CNNM1 functions as neuronal copper storage protein; brain-enriched expression","glioma (epilepsy-glioma shared gene network screen)",NA,"epilepsy (co-expressed network with glioma); ataxia (region-level)","expressed in testis during spermatogenesis; expressed in neurons","Neuronal copper storage protein (CNNM1) and probable metal transporter; brain-enriched expression; linked to neurodegenerative and epilepsy networks."
"Jph3","structural protein","junctophilin-3; bridges plasma membrane and ER at junctional membrane complexes (JMCs) in neurons; required for ER-PM coupling; brain-specific; slows Cav2.1 inactivation; motor coordination and memory circuits","Cav2.1 (P/Q-type Ca2+ channel); plasma membrane lipids; ER membrane","plasma membrane-ER junctional complex","brain (striatum; cortex; hippocampus; cerebellum)","neurons (striatal; cortical; cerebellar)","ER-PM junctions; neuronal Ca2+ signaling; motor coordination; memory; Cav2.1 modulation","impaired coordination","mild","impaired motor coordination","expressed in brain; required for motor coordination; ER-PM junction formation in neurons",NA,NA,"Huntington disease-like 2 (HDL2; trinucleotide CTG/CAG repeat expansion in JPH3); chorea-dementia syndrome","expressed in neurons during brain maturation; ER-PM junction assembly required for proper neuronal function","Brain-specific junctophilin-3 forming ER-PM junctions; trinucleotide repeat expansion in JPH3 causes Huntington disease-like 2 (HDL2)."
"Atp10a","transporter","P4-ATPase flippase; transports phosphatidylcholine from outer to inner plasma membrane leaflet; facilitates ITGB1/beta1-integrin endocytosis","phosphatidylcholine, glucosylceramide","plasma membrane","broadly expressed; liver, intestine, kidney, retina","epithelial cells, retinal cells","phospholipid flipping, endocytosis, integrin signaling","obesity/lipid phenotype; abnormal retinal vasculature; male infertility; metabolic dysregulation","moderate","abnormal retina vasculature",NA,"multiple myeloma (circRNA association in angiogenesis screen)","indirect/expression association",NA,"imprinted locus; may influence cell-type identity via phospholipid asymmetry","P4-ATPase flippase that maintains plasma membrane phospholipid asymmetry and promotes integrin endocytosis; located in an imprinted genomic domain."
